text,label
"6 Years Before George Santos, Trump’s Endless Lying Made Him President",0
Fight for Change Where You Live,0
A Black professor defies DeSantis law restricting lessons on race,0
Tucker Carlson Goes Off the Deep End With Roger Stone ‘Fashion Police’ Segment,0
DA Appoints Republican Legislative Candidate as Special Prosecutor to “Rust” Case | | Santa Fe Reporter,0
"NRA spin on Newport teacher shooting.
The only way to stop a bad first grader with a gun is a good first grader with a gun. So, all you good mommies out when you pack little Johnny and little Suzy's lunch DON'T forget to pack Their bible and a gun. 
""This is satire, but I'm really surprised they didn't come up with it and have a Trump flunky spout it on Fox news""",0
Florida Rejects A.P. African American Studies Class,0
Democrats prepare for House GOP to deny members key committee posts,0
"Kamala Harris should run for 2024 instead of Biden
There are some good things that Biden is doing and some bad",0
"Are there any democrats who I can follow on Truth social?
Are there any democrats who I can follow on Truth social?",0
"Of course he did....
https://news.yahoo.com/santos-shows-early-signs-tilting-131252253.html

On his first day in Congress, Rep. George Santos of New York spent most of his time alone, isolated from his new colleagues. But by week’s end, he had found hi...",0
This Is How Red States Silence Blue Cities. And Democracy.,0
Numbers Don’t Lie. Biden Kept His Promise on Improving Obamacare,0
The Plan to Keep Abortion Rights Atop Voters Minds for the Next Two Years,0
SNL does bizarre Trump & Jesus skit,2
"Trump, Kid Rock & Mike Tyson make Explosive entrance at Miami UFC event. Crowd chants USA as they cheer on their Favorite President!",2
Hal Turner Radio Show - Ports at Los Angeles and Long Beach CLOSED; 40% of All Goods into U.S.A. Comes to Halt,2
"Biden on 2024: “Well, I’ll either, I’ll eith—I’ll either be rolling egg or, uh, being the, the gu—you know, the guy who’s pushing them out”",2
"DeSantis grills Fed for considering digital central currency, argues it will be abused",2
Fiddling America Away › We fixate only on the irrelevant that we think we can address while ignoring the existential we know we no longer can solve.,2
$4.7 Million in Small Amounts of Money Donated to Democrats – Apparently Without the Donors’ Knowledge,2
AOC: Texas Judge's Ruling Against Abortion Drug 'Is an Extreme Abuse of Power',2
North Carolina Cosmetic Surgery Clinic Brags About Performing Sex Changes On ‘Trans’ Kids With Before And After Pictures — Panics After Backlash,2
WATCH: The Biden Admin’s Gaslighting Of The American People on Afghanistan,2
WATCH: Kamala Harris Screams With Rage During Major Public Appearance As She Defends Tennessee Insurrection,2
"Student loan ‘train wreck’: As return of regular payments loom, servicers have less staff to field expected deluge of calls",2
JPMorgan's Dimon: Banking Crisis Increases US Recession Odds,2
Trump Attorney Spars With NBC: DOJ 'Desperately' Seeking Obstruction Charge,2
"Alan Dershowitz to Newsmax: Bragg Case 'Scandal,' 'Travesty of Justice'",2
Trump: Dems Rigging 2024 With 'Boxes Hoax',2
Hundreds Of Social Media ‘Influencers’ To Tout Biden’s Record Ahead Of 2024 Election: Report,2
Statute Of Limitations Has Passed On Bragg’s 'Get Trump' Case,2
"Macron's Words After Meeting With Xi Are So Bad, They Should Be Setting off Alarms for U.S. And Taiwan",2
"U.S. Bank Lending Sees Biggest Drop Since 1973, Surpassing 2008 Financial Crisis",2
"WATCH: Trump Gets Standing Ovation at UFC, Jorge Masvidal Leads 'Let's Go, Brandon' Chant",2
"Democrat Politician's Son ARRESTED For Threatening School, Mom LIES & Blames DeSantis",2
Riley Gaines blasts SF State faculty member who called protests at heart of incident 'peaceful',2
"Bud Light's marketing VP says she was inspired to update 'fratty,' 'out of touch' branding with inclusivity",2
"Riley Gaines, a former NCAA athlete, unloaded on Ed Jamillah Moore. D., vice president for student affairs and enrollment management at San Francisco State University, over her response to a protest at the Turning Point USA event last week. https://www.conservativenewsdaily.net/",2
KJP Crosses a Bright Red Line at White House – Critics Accuse Her of Incitement Charge,2
"Top House Republican Warns: U.S. Needs To Arm Taiwan Fast, Beef Up U.S. Military Presence To Avoid War",2
Pentagon Shares Easter Sunday Update On Classified Docs Leak,2
Gavin Newsom Thinks Constitutional Carry Allows People to Carry ‘Weapons of War’,2
Report: Biden Recruits ‘Army of Influencers’ for 2024 Race,2
San Francisco activist calls for change after fatal stabbing: 'Tired of being subjected to social experiments',2
After 2 Democrats Booted from Office – 2 Presidents Lose Their Minds in Childish Meltdown,2
"Trump, Kid Rock And Mike Tyson Bring Down House In Miami With Surprise Appearance At UFC Fight",2
Graham: ‘I’d Be Very Much Open’ to Sending U.S. Forces to Taiwan,2
Insane Ai art depicting Donald Trump characters in some classic films 🤯,2
Riley Gaines threatens 'legal action' after being attacked by trans-rights activists,2
"House GOP Expands Probe Into Biden Election Interference, Targets DOJ Attorney Used to 'Jump St",2
Matthew Whitaker to Newsmax: Bragg Case Meddles in '24 Election,2
China is Penetrating America from Top-to-Bottom to Soften It Up for 'Inevitable' War,2
"The US Sending Troops to Taiwan is 'On the Table' if China Invades, Congressman Warns",2
China is 'Firing the Opening Salvo' in a Military Confrontation Over Taiwan: Report,2
"George Soros' Son a Frequent White House Visitor, Records Show",2
"China Encircles Taiwan During Concerning 'Drills' to Strike Island, McCaul Discusses Possibility of US Troops",2
Ukraine Intelligence Docs Leak Could be Worst for U.S. Govt Since Snowden: Report,2
"Matthew Whitaker to Newsmax: Bragg Case 'Flimsy,' Likely to Be Dismissed",2
Gordon Chang to Newsmax: China's 'Utter Disrespect' for Biden 'Really Serious',2
North Dakota become the 15th state legislature to pass a bill banning transsexual drugs/procedures for minors!,2
It’s Not Just About Trump › All the muscle flexing is meant to show how the Democrats and their government and media allies go after someone who stands in their way.,2
People With Taste Buds Continue Decades-Long Boycott Of Bud Light,2
A Hiccup in the Prosecution of the J6 Defendants,2
Texas school district's 'Women and Gender Studies' course taught students to use 'gender-neutral' language,2
Kamala Harris hammered for 'loud' defense of expelled Tennessee Democrats: 'What's wrong with this lady?',2
BREAKING: Riley Gaines to ‘pursue legal action’ following violent assault at TPUSA-hosted SFSU event,2
VP Harris ripped for meeting expelled Tenn. Dems — but not mass shooting victims,2
"Austin Court Finds Army Sgt. Guilty of Murder After BLM Protesters Blocked Car, Gunfire Broke Out",2
Greg Abbott working to 'swiftly' pardon Army Sergeant convicted of murder in BLM riot!,2
California Bill Would Let 12-Year-Olds Leave Home Without Parents' OK,2
"Houston school student, 15, punches teacher in the head after demanding to get his cell phone back",2
"New details, video in brutal attack of former SF fire commissioner in Marina District",2
Kamala Harris hammered for 'loud' defense of expelled Tennessee Democrats: 'What's wrong with this lady?',2
"Rebekah Jones, a rejected conspiracy theorist and twice-failed Democrat member for Congress, had his 13-year-old son detained this week in Florida on suspicion of threatening to shoot down an elementary school. https://www.conservativenewsdaily.net/",2
CNN Gives Devastating News About Joe Biden on Live TV,2
U.S. Army Sgt. Found Guilty of Murder After Shooting Protester Whom He Claimed Raised Gun First,2
Texas AG Blasts ‘Soros-Backed’ Travis County DA After Soldier’s Shooting Conviction,2
Oversight Committee Subpoenas Banks For Biden Family Associates’ Financial Records: Report,2
Immigrant Republican Lawmaker Blasts Democrat Lawmaker Expelled From TN House: He Called Me A ‘Slur’,2
NextGen America Volunteers Use Dating Apps to Increase Voter Turnout,2
Wannabe CO shooter's mom says family decided to call 911,2
CBS host warns Tennessee GOP that ‘maximalist’ expulsion of Democrats is asking for violence,2
Tennessee Republicans Perfectly Handled Insurrection-Instigators,2
"Abortion clinics will get 'special status' under new zoning rules, DC-area church warns",2
Riley Gaines defiant after 'terrifying' encounter pro-trans protesters: I won't be silenced,2
Two-Thirds Of Americans Say Biden Does Not Deserve Another Term As President,2
Police Arrest Rebekah Jones’ Son For Alleged School Shooting Threat; She Claims DeSantis ‘Kidnapped’ Him,2
Cowardly Republican Who Saved TN Insurrectionist Puts Out Incredibly Odd Statement,2
Child sex changes prohibited by Kansas legislature,2
Newsom Touring The Country As Even He Can’t Stand Being In California Anymore,2
Here's how the media covered the arrest of a Florida kid who threatened to shoot up a middle school,2
"Nashville: VP Kamala Harris Pushes ‘Assault Weapons’ Ban, Red Flag Laws",2
REPORT: Police Say No Arrests Made After Transgender Mob Assaulted Swimming Star Riley Gaines,2
Donald Trump arraignment judge under scrutiny,2
House Chair Jordan Probes NY Prosecutor in Trump Case,2
Justice Clarence Thomas Defends Vacations With GOP Mega-Donor,2
'Absolutely Shameful': MSNBC Makes Blasphemous Mockery of Good Friday,2
"Stormy Daniels Reveals Real Reason She Took 'Hush Money,' Says Trump Shouldn't Go to Prison",2
Classified US national security docs turn up in 'nightmare' leak,2
The Smearing of Clarence Thomas. The left gins up another phony ethics assault to tarnish the Supreme Court.,2
"House Oversight Committee subpoenas banks, Biden family associates in probe of finances",2
"Florida Sheriff Billy Woods goes off after reporter asks about gun control following teen murders
TRUTH!",2
"Israel terror attack in Tel Aviv leaves one dead, multiple injured after car rams into crowd",2
Whoopi Goldberg Blindsided by Her Audience – They Just Laughed at the “Wrong” Joke,2
Dem Rep Who Wasn’t Expelled in TN Demonstrates Why You Never Show Mercy,2
Transgender Teen Arrested For Planning School Shooting,2
Trump Maintains Nearly 30-Point Lead Over DeSantis In Latest Polling,2
Florida Sheriff Billy Woods goes off after reporter asks about gun control following teen murders,2
"Candace Owens Puts AOC In Her Place: “Your gloves off hood talk isn’t scaring anyone, clown, I was born in New York”",2
"DeSantis threatens new taxes, tolls targeting Disney as feud escalates: 'We're going to win'",2
"Bud Light, Nike trans activist partnership is the worst kind of ‘woke capitalism,’ says Vivek Ramaswamy",2
"Happy Easter! Death, Resurrection & Rebirth, Joe Biden Joke of the Week",2
The GOP’s Abortion Flop. A Wisconsin Supreme Court drubbing is the latest indication of the need to find the sensible middle.,2
"DeSantis: Republicans Have Developed ‘A Culture Of Losing,’ In Florida We Have ‘A Culture Of Winning’",2
Ford Is Eliminating AM in Cars In A Clear Attempt To Silence Conservative Talk Radio,2
"Swim Champ Riley Gaines Attacked By Radical Trans Mob, Forced To Barricade",2
"WATCH: Riley Gaines Assaulted, Held Hostage by Militant Transgender Activists After Speech",2
The GOP Has a Youth Problem and It's Costing Them,2
WATCH: WH Press Sec Refuses To Say If Killing Christian Kids Is A Hate Crime,2
"Doocy Wrecks Kirby Over Gaslighting on Afghanistan Report, Claim That Purpose 'Is Not Accountability'",2
Jean-Pierre slammed for praising trans kids who 'fight back:' 'Stochastic terrorism from the White House',2
CBS Reporter Blows Up John Kirby Over Afghanistan Report,2
Riley Gaines 'ambushed and physically hit' after Saving Women's Sports speech at San Francisco State,2
"For The Record, NPR Absolutely Is US State Propaganda",2
Yielding to Temptation: Why The Trump Case is a Test Not Just for the President but the Legal System,2
Rep. Donalds to Newsmax: Trump Can Hit the Ground Running,2
Trump's Surprise Millennial Wave: Here Are the Polls They Don't Want You to See,2
Donald Trump: Being detained helped me - Discover Politics,2
Joe Biden Classified Documents Bomb Dropped Live on Jesse Watters' Show,2
"Stormy Daniels Story plot hole
Am I crazy - I just watched Stormy Daniels on Pierre Morgan tell him a story about her asking Trump about his hair because ""at the time Trump was in a bet with Vince Mcmahon on WWE"".

The WWE episodes were in April 2007 and she allegedly had sex with him in June 2006?

This is just all totally fake?",2
More Flexing 🔥 one down two to go,2
"Transgender Suspect With Communist Manifesto Arrested For Planning Shootings At Schools, Churches: Police",2
"Ex-ABC News producer James Meek indicted on three child pornography counts, year after FBI raid",2
Biden Blames Trump For Afghanistan Exit,2
"Small Businesses Going Bankrupt at Record Pace, Higher Than During Pandemic",2
Millionaire Tech Founder Murdered in Ultra-Liberal City – Sends Shockwaves Across America,2
US House Speaker Meets With Taiwan's President,2
"Jim Jordan Checkmates Manhattan DA, Subpoenas Alvin Bragg’s Star Prosecutor Who Abruptly Resigned Last Year",2
Former Porn Star Stormy Daniels talks about her Day that she allegedly Slept With Trump despite a Signed Letter from her admitting an Affair never happened,2
Rep. Donalds Announces Trump Endorsement,2
Eric Trump to Newsmax: N.Y. Spent $200M Investigating Father,2
Rep. Jordan Subpoenas Pomerantz in Trump Indictment Oversight,2
North Carolina Dem Rep. Switches to GOP After Being Attacked By Own Party — Gives Republicans Veto-Proof Majority,2
"GOP Preparing INDICTMENT OF BIDEN, Democrats PANIC As Trump Indictment BACKFIRES",2
Three GOP Reps. Introduce Gold Standard Bill to Stabilize the Dollar's Value - Headline USA,2
Exclusive: Jim Jordan Subpoenas Manhattan Prosecutor Who Resigned over Suspended Trump Probe,2
DeSantis visits Michigan amid 2024 speculation,2
Former Trump campaign official joins Ramaswamy's 2024 GOP bid,2
Video Shows Cash App Founder BEGGED For Help After Being Stabbed In Lawless San Francisco… But Bystanders Ignored His Plea And He Died,2
"Biden Announces $2.6 Billion To Fund Armed Guards At Schools… Just Kidding, He’s Sending It To Ukraine Again",2
Michigan State University torched for 'preposterous' language guide: 'This is anti-Christian bigotry',2
White House slammed for saying 'a child and their parents' should decide trans surgeries: 'This is madness',2
Former trans influencer blames TikTok stars for rise in gender ideology: ‘A trend that destroys lives’,2
UNSTOPPABLE: Trump campaign raises whopping $10 million since indictment,2
Trump CALLS OUT Manhattan DA Alvin Bragg: ‘The criminal here is the district attorney’,2
Comer: County Attorneys Asking How They Can 'Go After the Bidens' Now,2
Comer: GOP Prosecutors Now Looking at Possible Biden Prosecutions,2
Leonardo DiCaprio Testifies in CCP-Related Influence Scheme to Funnel Millions to Obama Campaign,2
Texas AG Ken Paxton Sues Biden Administration for Over $1.7 Trillion Omnibus Package,2
"Obama IMPLICATED In Massive $30M Money Funneling Scheme, James O'Keefe Uncovers Potential FRAUD",2
"China to inspect ships in Taiwan Strait, Taiwan says won't cooperate",2
"VDH - the best perspective of Trump indictment
Hanson is a gleaming lighthouse for us today!",2
"“You’re a Sad Old Drunk! – You’re a G*ddam War Criminal!”, Viral Video! Things go Horribly wrong for Nancy Pelosi as 4 Protestors Heckle her at New York City Event",2
Now We Know Why They Wanted to Keep the Trump Indictment Sealed,2
"While You Were Distracted by Trump, Republican House Probe Targets Biden's Ex. Secy About His Absconded Classified Documents",2
Comer: GOP Prosecutors Now Looking at Possible Biden Prosecutions,2
Trump 2024 Bid Notches Sixth U.S. Senator Endorsement,2
House Investigators Speak With Biden Aide For Docs Inquiry,2
Trump charges rarely pursued as 'top count' in NY: report,2
North Dakota Gov. Burgum evades questions about speculated presidential run following Iowa trip,2
"On Wednesday, Florida Governor Ron DeSantis (R.) received another endorsement for presidency from a member of Congress, despite not having officially announced his candidacy yet. Representative Thomas Massie (R., Ky.) https://www.conservativenewsdaily.net/",2
"A mother in Maine is taking legal action against her local school board for not informing her that her daughter had transitioned genders. Amber Lavigne found a chest binder, an undergarment used to flatten breasts, in her daughter's belongings. https://www.conservativenewsdaily.net/",2
"'Legally weak,' 'painfully anticlimactic' Manhattan district attorney Alvin Bragg (D.) / Getty Images Former President Donald Trump pleaded not guilty on Tuesday to 34 criminal charges brought by Manhattan district attorney Alvin Bragg (D.). https://www.conservativenewsdaily.net/",2
"North Carolina State House Rep. Tricia Cotham Switches to Republican Party, Gives Them Super Majority",2
At least 2 GOP DAs want to prosecute Bidens after Trump arrest: Comer,2
Transgender Lutheran Minister Says Nashville Shooter Audrey Hale Was a Lot Like Jesus,2
Kid Rock is angry at Budweiser after Transgender Advertisement comes out. He says what all Patriots are also thinking right now (VIDEO),2
Rasmussen Poll Stunner: Trump Gains 10 Points on Biden Since Indictment,2
Mark Levin: We 'Need to Stand Behind' Trump,2
"Progressive Wins Wisconsin Supreme Court Race, Creating First Democrat Majority in 15 Years",2
"Trump Calls on Congress to Defund the FBI and DOJ, Says Democrats Have ‘Weaponized’ Law Enforcement",2
‘I hope he does it’: Kentucky’s Massie likely to endorse DeSantis for president,2
James O'Keefe hangs out with Radical Left MSM at the New York City Indictment Circus. Their hate for Trump is once again Exposed (VIDEO),2
Basketball Star Angel Reese Rejects Jill Biden’s Apology: ‘We’ll go to the Obamas’,2
"What is a woman? Kansas Legislature passes bill defining male, female",2
'We are going to see parts of the economy break': Recession fears move back to the forefront of markets,2
"The biggest part of the U.S. economy slowed in March, ISM finds, as strains mount",2
Christian mother sues state for denying adoption over her gender beliefs: Putting 'politics over children',2
El Salvador President MOCKS America For Trump Arrest — ‘They Can No Longer Condemn Political Persecution In Other Countries… They Are No Longer A Democracy’,2
North Carolina Democrat Switches Parties Giving GOP Veto-Proof Majority,2
Trump leads in 2024 presidential polling despite indictment,2
Trump Campaign: $10 Million Raised Since Indictment,2
Bragg Grilled Over Previous Efforts to Charge Trump,2
Judge to Trump: 'Refrain' from Agitating on Social Media,2
"Court Says Daniels Must Pay $122,000 in Legal Fees to Trump",2
"Trump: Defund DOJ, FBI",2
Trump: My Only Crime Is to ' Fearlessly Defend Our Nation',2
Please pray… Tech Mogul Stabbed To Death In San Francisco’s Rincon Hill Neighborhood,2
Trump Says He Thought a Political Prosecution of a Former President 'Would Never Happen in America',2
"Judge Warns Trump To Refrain From Posting On Social Media, Claiming Messages Could Inflame Civil Unrest – Trump Posts Anyway",2
Trump Delivers Feisty Mar-A-Lago Speech After New York Arraignment,2
Trump Takes Aim At New York Judge’s Daughter Over Dem Clients,2
No One Is Above The Law? Give Me A Break,2
Trump Indictment Is More Pathetic Than We Could Have Dreamed,2
Alvin Bragg Asks Judge to Hold Trump’s Trial During Primary Season,2
"Trump’s Blistering, Effective Speech Puts Him Right Back in the Running for 2024",2
"Alvin Bragg's weak, politically driven indictment threatens to rip America apart",2
The Prime Minister of Hungary Orbán: We are with you Donald Trump,2
"""The only crime I have committed was to fearlessly defend our country against those who are trying to destroy it,"" Trump told supporters - Discover Politics",2
Judge Declines to Impose Gag Order on Trump — Cites First Amendment and His Candidacy,2
Trump's New York Indictment Turns One Hush Payment Into 34 Felonies. Prosecutors are counting each record misrepresenting the former president's reimbursement of that payment as a separate crime.,2
Alvin Bragg Faces the Inconvenient Truth as People Notice NO ACTUAL LAW Is Cited in Trump Indictments ⋆ 🔔 The Liberty Daily,2
FACT CHECK: Marc Thiessen Falsely Claims Majority of Republicans Want Nominee Other than Trump,2
Rep. Ronny Jackson Slams Manhattan DA Alvin Bragg for ‘Manipulating a Presidential Election’,2
Dr. Ben Carson ‘Proudly’ Stands with ‘Friend Donald J. Trump’ on Day of Arraignment,2
"Pollak: Donald Trump, Political Prisoner",2
Dershowitz to Newsmax: Trump Case 'Not Justice in America',2
Lewandowski to Newsmax: Trump Will Fight 'Surreal' Charges,2
RNC's McDaniel to Newsmax: Trump Fight Energizing GOP Base,2
Trump Pleads Not Guilty on 34 Counts of Falsifying Business Records,2
BREAKING: Former President Donald Trump Has Been Arrested,2
Gun Control Advocates Who Occupied Tennessee Capitol Will Not Face Charges,2
"SECOND TRUMP INDICTMENT COMING, Secret Service Will Testify AGAINST Trump",2
Video: SECDEF Austin says no ‘regrets’ about Afghanistan withdrawal,2
WY Minority Whip posts violent Antifa material on Tik Tok,2
"Nashville police find suicide note, yearbooks, weapons and ammo at school shooter Audrey Hale’s home: report",2
Women’s College Basketball Champion Tells Jill Biden To Pound Sand: “A Joke”,2
Democrats drop oppo dump on Ron DeSantis in effort to derail White House hopes,2
"Now we have this from Build a Bear
These progressives do not want children to have a childhood, they must be indoctrinated.",2
Supreme Court Rules on Major Trump Case – They Just Handed Donald’s Administration a Historic Victory,2
Former Arkansas Gov. Hutchinson Announces Presidential Run,2
WATCH: US Cardiologist Warns Over 100 MILLION Americans May Have Heart Damage Due To Covid Vaccines,2
Possible Second Trump Indictment Looming in Washington D.C.,2
Hillary Clinton Calls For An End To Free Speech — ‘America Should Become More Like Europe’,2
BOMBSHELL Discovery: Democrat Party Caught Stealing MILLIONS From Unemployed Elderly In The Form Of Fake Campaign Donations,2
US Manufacturing Reaches New Low as Biden Tours American Factories,2
The Trump Indictment And The Coup Against America,2
"JPMorgan's Jamie Dimon says banking crisis is 'not over,' but it will pass",2
Google parent company reportedly targets staplers in cost-cutting drive,2
"Google Workers Lose Fitness Classes, MicroKitchens, Other Perks As Company Cuts Costs",2
"Now It’s McDonald’s: All U.S. Offices Temporarily Closed, Prepares For Layoffs",2
Small Business Bankruptcies Reach Worrisome Level As Biden Touts Rising Business Formation,2
There Is No Upside To Trump's Persecution - The Federalist,2
Why All The Other 'Get Trump' Cases Are Just As Weak As Bragg's,2
Those '34 Charges' Against Trump May Not Be What They Seem,2
"REPORT: Trump Charged With 34 Felony Counts, Former President Hilariously Tells Bragg to Indict Himself",2
Huckabee to Newsmax: Indictment 'Not Just' About Trump,2
Jon Voight: Trump Will 'Save This Nation' Despite 'Cruel' Indictment,2
"Report: Trump Will Face 34 Felony Counts, but Neither Cuffs Nor Mug Shot",2
Massachusetts Poll: Donald Trump Leads Ron DeSantis by 24 Points,2
Trump Bashes Bragg for ‘Illegally’ Leaking Points of Indictment to Media: ‘Should Resign Now’,2
Colorado district equity docs reveal methodical system to deceive parents on in-school social transitions,2
Bud Light Faces Boycott Over Dylan Mulvaney Partnership: 'Never Drink It',2
Dem Reps Who Egged on Rioters at Tennessee Capitol Are Stripped of Committee Assignments; Face Expulsion › American Greatness,2
Hillary Clinton Goes On Bitter Anti-American Rant With Nancy Pelosi,2
"Trump arrived in New York to 'Make America Great Again', here's what's happening - Discover Politics",2
Poll: Trump Holds 13-Point Lead over Crowded Field in New Hampshire,2
Mug Shot Could Be Financial Boon for Trump Campaign,2
"Reuters/Ipsos Poll: As Arraignment Looms, Trump Widens '24 Lead",2
Donald Trump Arrives at Trump Tower to Supporters’ Chants: ‘We Love Trump’,2
"Alvin Bragg, Soros-Linked District Attorney Behind Trump Charges, Builds Record Refusing to Prosecute Felonies",2
Popular AI platform censors itself for China,2
Who Is Alvin Bragg? - Judicial Watch,2
US Failed To Stop Chinese Spy Balloon From Gathering Intelligence From Sensitive Military Sites: Report - Breaking911,2
Dems Admit Trump Indictment Is Political By Fundraising Off It,2
Trump Isn't The First GOP Candidate Indicted By Local Democrats,2
"Gas Prices Are About to Increase Again, in Latest Saudi Slap to Biden - and That's the Good News",2
Do you feel like Barfing Today? I Dare you to try to Watch this entire One hour Conversation between Hillary Clinton & Nancy Pelosi (VIDEO),2
"Trump, in Flight, Urges 'Final Battle'",2
Trump Campaign Raises Record $7M Since Indictment,2
Washington Post Fact Checker Receives Two Community Notes From Twitter,2
NYC Judge Expected To Put ‘Gag Order’ on Trump,2
‘MAKE AMERICA GREAT AGAIN!!!’: Trump Comments On Trip To New York For Arraignment,2
OMG! Unfing believable. Far left radical activist & anti-second amendment David Hogg posts video of him Shooting at a Gun Range!,2
Marjorie Taylor Greene FULL interview with 60 Minutes: Democrats are a party of Pedophiles,2
