text,label
"How many liberals ""hate-watch"" Newsmax and/or Fox News?
I'm a registered Democrat and generally have liberal views across the board, socially and economically.

That said, I became fascinated by disinformation in 2020 and sought out the ""least biased"" news. I landed on PBS NewsHour and, to a lesser extent, NPR as well. (Though, I may be biased to the digestibility that is NewsHour's tidy hour-long nightly newscast M-F, and an easy 30 minutes that is NewsHour Weekend on Sat and Sun. I suppose there's a reason that NewsHour is the longest-running American news program, going strong for nearly 50 years.)

I also discovered www.mediabiasfactcheck.com, which is amateur but informative.

I'll turn on Newsmax in order to know exactly what drek they're promoting. With the recent hubbub of DirecTV dropping Newsmax 1 year after they dropped OANN, I noticed the same talking points were being parroted over and over again, in particular by R congressmen, that DirecTV carries ""22 liberal channels"", which supposedly dwarfs the number of conservative networks.

I've attempted to find this list of 22 channels but have come up empty. It's true that the mainstream news channels skew slightly left-center, but I wouldn't call CBS, ABC, and NBC intrinsically ""liberal"".
 I can only presume they're counting channels like C-SPAN and ESPN.

Is there a better subreddit to discuss the factuality of news that isn't of a particular political stripe? I can't even find a subreddit for real-time discussion of live or breaking news. R/findareddit turned up nada.",0
"What does it mean to be a Liberal in 2023?
If you asked me if I was a liberal six or seven years ago I would have immediately answered yes. If you asked me now I wouldn't be so sure. I also wouldn't consider myself a centrist. 

Both sides of the political spectrum seem to be getting more extreme. I feel like on either side you can't so much as even question why someone holds a certain view without being called a bigot (if you question the left) or woke (if you question the right). Even if the question comes from a place of attempting to understand/deepen understanding rather than challenging.

I like to discuss and hear different points of view even if they are something I might consider offensive or incorrect I still will listen to it. Because then I might be able put across my point of view more effectively and they will be more likely to listen. And also I've heard some things that sound bad at first when explained make sense.

So I'm curious. What does it mean to be a liberal?",0
Satanic Temple Opens Abortion Clinic Named “The Samuel Alito’s Mom’s Abortion Clinic”,0
"US Medicare and Medicaid Reform
**I’m conducting a short survey on US Political Stances on Medicare and Medicaid reform for my school research and I would really appreciate it if you could spare a minute to take it!**

&#x200B;

[https://docs.google.com/forms/d/e/1FAIpQLSe9Y7RgODwryPs4aT0UmeMt9vnLTIT-ueASMOKbFj4JBrBLDQ/viewform](https://docs.google.com/forms/d/e/1FAIpQLSe9Y7RgODwryPs4aT0UmeMt9vnLTIT-ueASMOKbFj4JBrBLDQ/viewform)",0
"THE WHEELS OF JUSTICE...
These are long days and torturous nights for Paul Gosar and Kelli Ward, both of whom have shown support for the insurrectionists at the United States Capitol.  

The Justice Department is deep into multiple investigations, investigations bolstered by evidence provided by the Jan. 6th Committee of the failed coup attempt, and they now possess a ‘landslide of evidence 'most of which comes from cell phones seized by the FBI.  

They have recovered a treasure-trove of information from the phones of Giuliani, Eastman, Scott Perry, Mike Lindell, Boris Eashteyn, Victoria Toensing, (both Giuliani advisors) Michael McDonald, and Jeffrey Clarke, just to name a few. 

For a few brief moments this week, the sugar plums of sedition again danced in congressional heads when the courts issued a hold on Scott Perry’s phone. Ah, but the funny thing about telephones is they are two-way devices. 

In the heat of the insurrection phone calls, text messages, and emails flew about the government like newspapers on a New York City Street in a windstorm, but unlike the newspapers, these have been collected, collated. and compiled into binders related to specific schemes and to specific personages, to overthrow our democracy. 

Schemes like mounting a concerted effort to invalidate a legitimate vote, schemes like falsifying a slate of phony electors to change the vote, and most insidious of all, a scheme to replace a recalcitrant Attorney General with a stooge who would claim he sees irregularities in the election and will have the military seize the voting machines where, God knows, what would be done to them. 

Yes, there are heavy heads on pillows as the Justice Department completes its mission. Gosar and Ward aren’t the only ones sleeping a fitful sleep, they are joined by Mo Brooks, Louie Gohmert, Matt Gaetz, Andy Biggs, Josh Hawley, Marjorie Taylor Greene, Mark Meadows, Jim Jordan, Tom Cotton, Mike Lee, Lauren Boebert, Jim Banks, and others in their sweat-soaked tossing and turning. 

It’s taking some time, but you know what they say about the wheels of Justice.",0
We all need to MAKE SURE that this person does not make it to the White House,0
The Latest Crusade to Place Religion Over the Rest of Civil Society,0
Rep. George Santos says he will recuse himself from committee assignments amid ethics issues,0
Supreme Court denies disabled veterans compensation in its first ruling of the term,0
"What does it mean to be a liberal?
I’m interested in the variance of thoughts on what it means to be a liberal. I consider myself a liberal. What does it mean to you?",0
"In Uganda, the president's son is getting ready to run | Semafor",0
Trump’s Killing Spree,0
"THE RED RIPPLE.
First, they expected a tsunami, a comber of explosive force that would wash away truth, logic, and integrity. But then they were forced to downgrade their expectations when their absurdities were met with derision and none but the disaffected and deranged applauded their efforts.

They gave up on the tsunami and settled on the ‘Red Wave’.

The ‘Red Wave’ did make it to the shoreline, but instead of a tidal wave of raging surf, it crept in, all a swell of sea foam and mist. It did drag in the flotsam and jetsam of irrationality and outright lies, but never made it far up the shoreline where a phalanx of sandcastles built by Generation Z rebuffed it with ease.

‘Gen Z’, better than 30% of the electorate by 2024, (11,000 of whom become eligible to vote every day; guess who they are supporting?) are just beginning to dip their toes into national politics but have already become a force of rationality and reason – they are offended by the absurdity of your lies and insulted by your condescension – and there are more of them every day.",0
"How do you feel about shows like Bad girls club?
How do you feel about reality shows like Bgc and Love and hip hop?",0
George Santos Is a Model Republican,0
"“Reason may help us win minds, but to win hearts, we must speak from the heart.”",0
"SICK of Trump supporters
I wanted get your guys take on these disney Donald Duck supporters (this is just a metaphor because I HATE saying this guy's name).

What do you do when you explain all the horrible, racist, xenophobic things he has said and done, and they're just like ""oh well where's the proof"".

I JUST TOLD YOU WERE YOU NOT LISTENING.
I'm sick of these yeehaw redneck toyota tacoma drivin truckers who listen to these CONSERVATIVE BIASED new stations, and use that as proof!

Do you have any suggestions on how to bait them, because I'm talking to this trumpy on facebook, and I want to OBLITERATE his argument.",0
"App to help you identify local businesses to not support
One of my far-right relatives was bragging about the app “public square” which is a place where “freedom supporting” (aka pro forced birth, anti-vax, etc) businesses can self register as such so that other conservatives can support them. 

Pro tip, the app works just as good for showing people who do not support these ideologies some good places to NOT support. I felt embarrassed having it on my phone but I downloaded it briefly and was surprised to see a few restaurants I had been to before.",0
"WHEN FOXES RULE THE HEN HOUSE.
 

An overwhelming number of Republicans want the House to address issues important to them. During the midterms promises were made that the matter of inflation, crime, and the southern border would be center-stage and a bi-partisan effort would be made to correct these problems. 

Do you want to know what happened to those promises? the whackos took over and are now promising us a new wave of Benghazi-like investigations, and like the eight Benghazi (Costing some seven million dollars) nothing will come of them except the opportunity to try and embarrass President Biden. 

Eight separate tribunals, seven million dollars, and at the end of the fiasco, Hillary, sitting alone and without benefit of counsel -- over the course of twelve hours -- answered all their questions and figuratively spat in their eye! 

Chairman Gowdy finally admitted nothing was accomplished by the two-year, four-month investigation. 

Now they are up to it again. 

Representatives who themselves are now under investigation by the FBI (Jim Jordan, who sat on the Benghazi committee) want to investigate the FBI. That’s like having Benedict Arnold sitting on his own jury or allowing George Santos to swear to the veracity of the witnesses. 

Maybe the FBI should be investigated, they are proving to be a real nuisance to Chinese spy rings, corporate crime (Their just announced indictment of Google), and political corruption, to say nothing of their investigation of 1/6 and the self-same Republican Representatives alleged to have been involved in the attempted coup. 

Oh, do you think...?",0
How Wisconsin’s Spring Election Will Impact Your Life for the Next 10+ Years,0
"My thoughts and prayers go out to all the children being taught by pink haired communists. That's how you solve major problems in school, right?",0
"Federal prosecutors discussed charging Trump in Stormy Daniels case when he left office, book says | CNN Politics",0
Tyre Nichols death: Memphis braces for protests when police body cam footage is released,0
"Rep. Adam Schiff announces 2024 Senate run, teeing up a high-profile primary",0
Tigrayan Struggle Continues,0
"Trump claimed victory at a weekend-long golf tournament despite missing half the play
https://sports.yahoo.com/trump-pilloried-4-old-cheat-080846940.html",0
G.O.P. State Lawmakers Push a Growing Wave of Anti-Transgender Bills,0
"[Hayek, Friedmann, Classic Liberal Theory] Are there valid reasons to subsidies Energycosts for consumers
Hey friends,

Context:

• In Germany we have introduced subsidies to cap gas prices to 12ct per united for consumers. The difference between market price and the 12ct per unit is payed for by tax-money.

• To incentivise conserving gas, this mechanism only works up to 80% (insentive: Safe 20%) of your gas-use in 2022. What is above that needs to be payed for by the consumer alone.

• Providers are legally forced to explain any rise in their retail price on gas in 2023 in fine detail, so that they can't artificially rise them to get more subsidies.

• There is no legal mechanism that forces providers to lower their prices.

In effect:

• This lowers the effective gas-costs for consumers on their bill, which is good.

• This uses up enourmous amounts of taxpayer money, which is reasonably bad.

• This eradicates any incentive for customers to seek out a (slightly) cheaper gas providers, which is bad. (Reason: Doesn't matter to you, as you pay 12cents max per unit either way. And it's unlikely anyone can provide for lower)

• It takes most incentives away from providers to lower their prices (because consumers don't really care), which is bad.

• This encourages providers to keep their prices high (as this grants them more € per subsidised unit), which is bad.

The question:

• When we look at classic liberal theory, can there be an argument for any sort of ""gas-price-break"" as it's called? Maybe a very low conservative cap at 50% of your former gas-use to uphold market pressures while also sustaining (more) buying power and general situation of the people?

• What is the outlook for the economy if no subsidues are introduced? Lower prices but effectively more burden on consumers. Where are consumers supposed to get that money from? Bank loans or liquidating posessions? -> Is there a limit where the government should intervene before people fall into poverty (in classic liberal theory)?

• Extra: Maybe any specific chapters I should read into?

&#x200B;

Thanks for your time an effort!",0
There is NOTHING more American than firing the superintendent of a district because a 6-year-old brought a gun to school and shot a teacher. It's a Masters Class of a solution amirite?,0
Is Right Wing Media Poisoning the GOP? With Matt K. Lewis of The Daily Beast,0
"What are conservative triggers besides ""woke"" M&Ms?
I'm trying to be better at understanding what triggers conservatives. Let's make a list.",0
A North Dakota Bill Would Fine State Employees for Respecting Trans Peoples’ Pronouns,0
"Republicans Are Outraged Over a 'Green' Xbox Update
""First your gas stoves, then your coffee, now they're gunning for your xbox."" -Ted Cruz

""They want to take your guns. They want to take your gas stoves. And now they want to take your xbox. What's next?"" -Congressman Troy Niehls

 “They’re trying to recruit your kids into climate politics at an earlier age.” Host - “You’re right - they’re going after the children!” -Fox News 

[https://gizmodo.com/xbox-carbon-aware-update-republicans-microsoft-climate-1850030437](https://gizmodo.com/xbox-carbon-aware-update-republicans-microsoft-climate-1850030437)

[https://www.newsweek.com/microsoft-changes-xbox-console-climate-change-republicans-ted-cruz-1776054](https://www.newsweek.com/microsoft-changes-xbox-console-climate-change-republicans-ted-cruz-1776054)",0
House Republicans Are Planning to Slash Social Security and Medicare,0
'I Can Speak From Personal Experience': Just Two Weeks Ago Pence Called for Special Counsel for Biden Classified Docs,0
"Help this ""Commiefornian"" choose a new home
Jokes aside, I absolutely love California. I live in a very liberal county, and I absolutely love most of it. The quality of life is wonderful, I adore the cultures I'm exposed to, love the big city life when the craving hits, and I'm happy with my access to everything from beaches to amusement parks. 

But, of course, cost of living is inexcusable. My husband and I want to go live our American dream somewhere more affordable, where we can buy a house and live happily and hopefully a bit more simply. That will mean sacrificing a lot, so it's a matter of deciding what those sacrifices will be.

We are liberal, childfree, alternative, white/cis/straight, and educated (him with a trade degree - hazmat, and I with a biology degree - emphasis in animal care). We are already expecting to face animosity as Californians moving into a less liberal state, but ideally we want to not be harassed for something so stupid.

As a liberal, where do you live and how do you like it? What helped you make that decision?",0
"America's hopelessly dysfunctional political system needs a serious overhaul.
I'll preface this by saying, in the near term, all of the following proposals I'm about to introduce will, unfortunately, not happen, but I do still continue to harbor the hope that in the future (by 2030-2035) there will be enough support to make these transformative changes a reality on the pathway to make America a more inclusive, representative, fair democracy.

Reforming the Judicial Branch

1. Expand SCOTUS to 13 members from the current 9. Instead of lifetime appointments, all justices will be restricted to fixed 18 year terms; once their term is up, they will be obligated to leave the bench. To reduce the currently extreme political implications of the SCOTUS nomination process (that are almost entirely caused by arbitrary circumstances such as death or retirement of a justice) all presidents will get the chance to nominate 2 justices, regardless of their political affiliation, in an effort to increase impartiality and fairness to the highest court in the land, which are characteristics that have been severely lacking in recent years. Lastly, all SCOTUS justices will be required to adhere to a Code of Ethics, since (amazingly) SCOTUS remains the only entity in the federal judiciary not to have one. As a side note, I believe the ethics issue is very relevant given the composition of today's court (Clarence Thomas, Samuel Alito etc.)
2. Expand the size of the lower federal courts: As important as the Supreme Court is, very few cases will ever make it there. Most of this country's legal problems are still solved in the lower federal courts. Many people don't realize that the current size and composition of this subset of the judiciary hasn't been updated in more than 20 years. With the current judiciary still overwhelmingly represented by white, often conservative males, it's become painfully obvious it doesn't represent the increasing diversity that America has. In addition to these issues, lower federal courts have become backlogged by increasing numbers of cases, plaintiffs, and claimants over recent decades, meaning important sentences for criminals or defendants in civil cases have to wait months for their cases to be heard before a judge.

Reforming the Legislative Branch

1. Fixing the U.S. Senate: The issues of the Senate go beyond the legislative filibuster. What gets done in the Senate these days? Almost nothing, except judicial and federal cabinet nominations it seems. The dysfunction in the Senate is particularly acute due to egregious Republican malapportionment. Democratic Senators currently represent 43 million more Americans than Republican Senators. A state like Wyoming has over 60 times the voting power compared to California, even though both states share 2 Senators. The issue of the Senate is really overlooked I feel, even among many Democrats. How to change this? A simple solution: do away with the ""2 Senator state rule"" and replace it with a proportional system. All Senators will be allocated to States based on their populations. For example: a state like Vermont or Wyoming would only get 1 Senator, while a state like California would get 12 or 13. The effects of malapportionment can also be mitigated by admitting the District of Columbia and Puerto Rico as States to give them the representation they deserve. Lastly, Senators will be restricted to two six year terms.
2. Dramatically expand the U.S. House and introduce proportional representation: did you know the current size of the House hasn't changed in almost 100 years? Yes, you read that correctly, as America's population has grown and diversified, the House has stayed fixed at 435 members. This is deeply concerning, because many overlooked communities in America today don't feel they have adequate representation. The solution is to expand the current House from 435 members to 735. Most importantly, all members will no longer be elected in ""winner take all"" districts but instead will be elected through a proportional system. The lines of these congressional districts will be drawn either by a non-partisan commission or by an A.I. process that attempts to make the districts as competitive as possible. Gerrymandering will be outlawed; state legislatures will no longer have the authority to draw the boundaries of congressional districts. House members will only be permitted to serve three two year terms.

Reforming the Executive Branch

1. Presidents will be elected by a nationwide popular vote, the Electoral College will be abolished. That is all.

Expanding Voting Rights

1. Federal legislation needs to be passed that would require states to, among other things: make Election Day a national holiday, require same day voter registration for federal elections, expand the voter franchise to convicted felons (states will no longer be allowed to deny felons the right to vote), expand opportunities for vote by mail, require all states to have at least two weeks for early voting, reform the campaign finance system by incorporating a public financing option, reform provisions from the [DISCLOSE Act](https://en.wikipedia.org/wiki/DISCLOSE_Act),[\[11\]](https://en.wikipedia.org/wiki/For_the_People_Act#cite_note-nytimes-11)[\[24\]](https://en.wikipedia.org/wiki/For_the_People_Act#cite_note-RuaneGill-24) which would impose stricter limitations on foreign lobbying, require [super PACs](https://en.wikipedia.org/wiki/Political_action_committee#Super_PACs) and other ""[dark money](https://en.wikipedia.org/wiki/Dark_money)"" organizations to disclose their donors, and restructure the [Federal Election Commission](https://en.wikipedia.org/wiki/Federal_Election_Commission) to reduce partisan gridlock. The bill expresses support for a constitutional amendment to overturn [*Citizens United v. FEC*](https://en.wikipedia.org/wiki/Citizens_United_v._FEC)[\[6\]](https://en.wikipedia.org/wiki/For_the_People_Act#cite_note-npr-6)[\[25\]](https://en.wikipedia.org/wiki/For_the_People_Act#cite_note-vox-25). Additionally, all candidates running for President and Vice President, will be required to adhere to a Code of Ethics that would, among other things, require them to disclose their tax returns from the last 10 years.",0
"Classified Documents Found at Mike Pence's Home
Classified documents found at Pence’s Indiana home 
https://share.newsbreak.com/2vxro2iw",0
"Iowa GOP Moves To Stop SNAP Users From Buying White Rice, Fresh Meat And More",0
Rightwing Group Pours Millions in ‘Dark Money’ Into US Voter Suppression Bid,0
"How do you feel about the Biden documents?
I think Biden should be investigated for this. Anyone agree or disagree?",0
"Florida's AP African American studies ban should raise alarm elsewhere, lawmaker says",0
"One Year After the Expiration of the Enhanced Child Tax Credit, What All Have We Learned About Its Effects?",0
"Just gotta be honest: we have bigger things to worry about than getting Conservatives out of office. Let me explain…
Before Trump took office in 2016, I thought it was in America’s best interest to elect a leader that would bring people together, reinforce trust between our citizens and defend America from any enemy of any scale. 

Seven years later, here we are… 

1 Million Americans are dead of COVID-19, Neo-Fascists are on the rise, a second civil war seems imminent, there’s a shortage of what seems to be every single vital resource and job, from water to microchips and from doctors to retail workers. 

We’ve seen and witnessed a significant decline in quality of life since 2015, and it just keeps getting worse and worse. And eventually, you start to understand a tragic idea:

Maybe our fellow Americans can’t be trusted. Maybe America is beyond help and is on the verge of death. Maybe a decade from now we won’t have walls at our southern border, but between modern-day US States to protect us from people we once called our fellow Americans but now see as threats to our safety.

What I am talking about is something vital for America to even continue to exist:

Trust.

We don’t trust one another to do the right thing. Eventually that might become so severe that we’d rather divide America and start smaller. Because we can’t trust one another, we can’t trust our courts, we can’t trust congress and we can’t trust our leadership.

I do sincerely hope things get better, but I don’t think people really will care until severe consequences are on the table. Like the end of the union. 

What are your guys’ thoughts? Do you think things will get better? Because I know in my heart that we will do the best we can for one another in the end, but I know we can’t continue to trust people who show no signs of change.",0
"Are their any anti catholic politicians.
Are there any right wing politicians or Christian nationalists who are anti catholic?",0
"Is Ron Klain, Biden's Chief of Staff, resigning due to the bungling of the Biden classified document search?
I've lost count, have we had four or five separate announcements of Biden possessing and turning over classified documents? The Biden administration has known for months that he possessed classified documents and has kept this secret from before the last election. I'm an armchair amateur but even I know you release bad news all at once. Is Klain the author of this disastrous slow trickle-truth strategy? Or should Klain have interfered with the attorneys and taken charge of the searches? Do you think Ron Klain is leaving the administration because of this obvious screw up?

[Biden Classified Document Timeline](https://www.cbsnews.com/news/timeline-classified-documents-biden-special-counsel-robert-hur/)",0
"Has anyone been able to view a copy of the 82 page A.P. introduction that Desantis shot down?
I'm very curious to know what the content was that swayed their decision of rejection of this. As a Florida resident with a middle school student, I'd like to know more details.",0
"George Santos, American Supervillain",0
New Damning Brett Kavanaugh Sexual Assault Allegations in Secret Sundance Doc,0
DOJ tells Jim Jordan that information on ongoing investigations is off limits,0
