text,label
Another House Republican Has Been Accused of Stealing GoFundMe Money. Looks like another Republican is pulling a George Santos,0
6 Orgs Fighting Back Against Anti-Trans Legislation in Tennessee and Beyond,0
"Shirts for the cause
I made some shirts to help fight this ridiculous drag show nonsense.  I'd like to try to sell them and donate to causes that will support fighting these crazy laws.  These are the shirts, but more importantly, anyone have any good candidates to donate to in the areas most impacted?  I know the name needs work, it was an initial cut at something, but they say things like ""Drag doesn't Discrimi(hate)"" and such.  


[https://www.etsy.com/shop/HateStore](https://www.etsy.com/shop/HateStore)",0
Conversation about what it’s like to be a liberal in a very red area:,0
No. Silicon Valley Bank (SVB) didn’t donate $73 million to BLM.,0
Noam Chomsky: The False Promise of ChatGPT,0
"In Wisconsin, Liberals Barrage Conservative Court Candidate With Attack Ads",0
"Will there be a price to pay for “cancel culture “ and how much will it cost the left?
Will the fairly recent trend of attempting to stop people from having certain positions, often even mainstream positions, cost us elections or maybe even the numerical majority of Americans?? 

Or will it win elections and /or increase the 
number of Americans who identify as liberals?",0
Republicans are Defining Domestic Politics on China,0
"Where will we land with all the parents vs. educators culture wars?
Once upon a time, parents and teachers were mostly allies. It's tiring to hear about one after another parental vigilante group go ""how dare you teach my child! We want parental involvement!!""

It's like it never leaves the news cycle these days. God forbid the whitewashed American historical narrative is updated! The latest iteration is libraries and drag queens.

Just as ""woke"" was co-opted by the right for ironic derision, it could be argued that ""politically correct"" has taken on a new additional meaning in the 2020s.

These helicopter parents aren't the traditional, stodgy Silent Generation/Baby Boomer parents depicted in 1980s teen movies. They *were* the kids in those movies: primarily Gen X, and, increasingly, Millennials. Why are these younger generations more sensitive/""concerned"" with their children's education? Is it just smart PR on the part of conservatives: ""no one can argue with wanting the best for and protecting children""?",0
Opinion | Why we should all be liberal: The power of an adjective,0
Does anyone notice a trend with these states?,0
Housing as human right? Advocates seek state amendment in California,0
'WOW!': John Oliver 'Can't Believe' What He Just Learned About Tucker Carlson,0
"Trump won’t testify before NY grand jury investigating hush money scheme, lawyer says",0
"Would Jon Tester make a good president?
I was listening to his interview on PBS News Weekend tonight and while listening to him, a word popped into my head: ""sensible"". A Democratic farmer from Montana. A man of the land, to whom much of Middle America could likely relate. There's a lot to like, based on his track record: https://www.ontheissues.org/senate/jon_tester.htm

States like in the upper reaches of the country, like Montana and Wisconsin, are so funny how they elect polar opposites to represent them. Ron Johnson and Tammy Baldwin couldn't be more different, and it's known around DC that they have one of the iciest relationships of any 2 senators from the same state. I don't know much about Steve Daines, but that's not necessarily a bad thing.

God bless him for running for a 4th term next year.",0
"What are some famous anti feminist hate groups?
Are there any anti gender equality groups?",0
"Man Who Painted ‘Groomer’ on Libraries Caught With Child Pornography, Police Say",0
"Corporations are NOT People (but Should be Taxed)
 

""Corporations are not people.  People have hearts, they have kids, they get jobs, they get sick, they cry, they dance.   They live, they love, and they die.  That matters because we don't run this country for corporations, we run it for people."" Elizabeth Warren

It would be nice if we finally taxed corporations in this country, but at least President Biden is proposing an increase in taxes for people with annual incomes over $400,000.  It would be nice if this bill also included corporations, since our society effectively treats corporations as equals to people if not better.   

https://www.rawstory.com/biden-tax-boost/",0
"how is it that Trump's cronies fall one after another (Stone, Manafort, Cohen, Weisselberg, etc, etc), yet Trump himself remains unscathed?
What is the secret? And the media is always like ""THIS IS IT FOR TRUMP!"" and nothing changes. Even these criminal charges for the Stormy Daniels payment are likely to be inconsequential.",0
"What Do We Think About Matt Taibbi, The Twitter Files, And The Congress Hearing?
I'm a long-l time supporter of Matt Taibbi, and he was getting a lot of flack from the democratic party, but I don't understand why. I would appreciate others' opinions on the matter.",0
Inside the “Private and Confidential” Conservative Group That Promises to “Crush Liberal Dominance”,0
"What do liberals think of China and US-China relations?
As a liberal Democrat, I have mixed feelings about China. My gut reaction to seeing Republican leaders badmouth China is to think we shouldn't do that and we should aim to make US-China relations as good as possible, especially relations with their (now effectively dictator or President with no term limits) leader Xi Jinping. On the other hand, maybe some of the bad things Republican leaders say about China has some merit. Like maybe China really is a dictatorship with an overpowered, top-down authoritarian government. China has vastly more public video cameras than any other country on Earth and those video cameras are hooked into a centralized Artificial Intelligence system that captures, stores, and identifies all the faces it sees (see [Mass Surveillance In China](https://en.wikipedia.org/wiki/Mass_surveillance_in_China)). Like the authorities in China can take a photo of anyone's face (or pull a photo from one of the cameras), upload it, and it will show when and where in the country that face was seen and it will be able to look up that person's identity, for example from ID photos, mugshots, and everywhere on the internet where photos of that person exist. They claim this system is to deter crime, but it's a little discomforting. There have been reports of them placing these cameras observing the entrances of homes of people who disagree with the government. I even read a story about the Chinese government trying to use brain scans hooked into AI to check for loyalty to the government. On the other side, after 9/11 the US set up surveillance systems on ordinary Americans like the recording of all phone calls, so it's not like the US is spotless when it comes to surveillance of its citizens. If the US really wants information on someone it can request that information from private companies like Google, Apple, Facebook, AT&T, etc. I heard that in China there isn't the division between private corporations and the government that exists in the US, but it's not like the US doesn't get info on private citizens from corporations in cases of things like actual or suspected crimes, terrorism, etc.


Then there's China denying that Taiwan is a separate country with its own democratic government (they split in the past after a war) and possibly invading Taiwan, sparking a military conflict. Then there's the persecution and mistreatment of Muslim Uighurs. On the other hand, during WW2 the American government effectively put all the Japanese in prison (""internment camps"") and obviously the US has a history of slavery, plus remember all the Muslim civilians who were killed in the US's wars in the Middle East, so it's not like we the US is unequivocally morally superior to China.

One thing that concerns me is the Chinese internet is closed off to public US websites like Twitter, Reddit, Facebook, Instagram, the New York Times, etc. Like the Chinese people don't have access to the outside internet, so the Chinese government can set the narrative and there is no visible counter-narrative. This is what's happening in Russia, with support for Putin still strong as they don't know the truth about the war in Ukraine.

On the other hand, even though China is a dictatorship, it is a left-wing, supposedly pro-proletariat ""people's dictatorship"", so maybe they have some stuff in common with the left wing in the US? I honestly don't know if China is neutral, friend, or foe.

One more thing. I don't know if there are some advantages that such a centralized, top-down system has over a spread-out, more bottom-up, more democratic system. Like maybe China has the capacity to out-pace the US in certain forms of research because Xi Jinping can just allocate resources and people-power to specific things without having to go through the democratic process. I don't know.

What do liberals think of China? Has anyone ever lived in China or does anyone possess a more informed opinion?",0
'I don't want to be next': Milwaukee sees 3 Black transgender women killed in 9 months,0
West Virginia to Ask US Supreme Court to Allow Transgender Athlete Ban,0
At least 9 GOP-led state legislatures want to restrict or criminalize drag shows.,0
Republican Governor in Drag; hypocritical. Now it’s time to raise money for vulnerable teens!,0
Jamie Raskin Targets Republicans In Explosive Takedown Of Jan. 6 Lies,0
Jenna Ellis: Ex-Trump attorney admits statements about 2020 election were false and is censured by judge,0
Another Pyrrhic Victory?,0
Inside the secret fascist group that is pushing anti-trans laws across the country,0
"Tucker Carlson ‘passionately’ hates Trump, and eight more key revelations about Fox News from new Dominion filings
More revelations come out in the Dominion lawsuit. I have to say I was a bit slack-jawed reading this in light of Tucker doubling down on the 2020 election being ""stolen"" this week with the Capitol footage. Again, I'm not understanding - is he just doing this for ratings when he clearly doesn't believe his lies? And is Fox News really ""News"" if they aren't even covering this lawsuit?

[https://www.cnn.com/2023/03/08/media/fox-news-dominion-filings-reliable-sources/index.html](https://www.cnn.com/2023/03/08/media/fox-news-dominion-filings-reliable-sources/index.html)",0
"The Company Offering Free Health Care to East Palestine? It’s a Right-Wing, Anti-Vax Project. The Wellness Company’s top brass are leaders in the “medical freedom” movement.",0
Why the Victims of Texas’ Most Lethal Abortion Bans Are Finally Going to Court,0
US Capitol Police chief rips into Tucker Carlson over 'offensive' use of January 6 footage,0
"how to maintain relationships with family?
I've been having a hard time lately trying to manage my family relationships in the midst of our insane politics in this country. My family is very much fueled by the Fox news machine and whatever they tell them to think. They're constantly trying to argue and shove their politics down my throat while I try my best to ignore them. They don't live in the same reality, so arguing with them is pointless. I've learned that the hard way. 

I just want to maintain these relationships and not destroy my family over politics but they make it so hard. Has anyone had success with this? How do you manage it? Just hoping for some advice separating family from politics. I don't want to feel anxiety about politics when I think of or see them.",0
Republican states say the FDA doesn't have the authority to override state abortion pill bans,0
"5 Texas women denied abortions sue the state, saying the bans put them in danger",0
Opinion | The Vibes Are Off With the Republican Party,0
"California to not do business with Walgreens over abortion pills issue, Governor says",0
"DeSantis and Florida GOP push fascist agenda, including expanding ‘Don’t Say Gay'",0
Jimmy Kimmel Tells Trump What'll Happen When He Finally Gets Arrested,0
CPAC speaker sparks alarm with call for trans people to be ‘eradicated’,0
"Newsmax host cuts off white CPAC guest just as he's about to launch into racial tirade: ""There's always talking about Jim Crow, Jim Crow. Let's talk about Jim Crow. You know what, actually...""
She cut him off and wrapped up with something safe about Democrats and Republicans needing to come together and the US is Red, White, and Blue.

His first name is John, he said he's from Ohio (despite mispronouncing East Palestine as ""Pal-uh-stein"" instead of ""Pal-uh-steen""). I can't recall his last name, but he had a prominent double chin.

&#x200B;

edit: I admit it should have been ""**They're** always..."", but I'll chalk it up to a sic, since we're talking about Republicans.",0
MMA fighters vow to protect drag queens from right-wing protesters,0
DeSantis appointee to new Disney oversight board suggested tap water could turn people gay,0
Denver students walk out of East High Friday to rally against gun violence at Colorado Capitol,0
"LEGAL Gun Ownership /Weapon Ownership should not be a Left vs Right Issue at all, the left needs to utilize the second amendment
 It is perfectly fine and reasonable to use a weapon to defend yourself in your home from criminals. People always say ""just call the police"" but what do you think the police have? The police will go into an apartment with 30 well-built men, all of them holding guns, body armor, and whatever to protect their lives. The police don't tell the guys to come out and ""fight like a man"" they shoot on sight. The government has no duty to protect you

[https://ehlinelaw.com/blog/do-police-have-a-duty-to-protect-me#:\~:text=True%2C%20Unless%20police%20have%20assumed,occur%2C%E2%80%9D%20said%20Darren%20L](https://ehlinelaw.com/blog/do-police-have-a-duty-to-protect-me#:~:text=True%2C%20Unless%20police%20have%20assumed,occur%2C%E2%80%9D%20said%20Darren%20L)

.

"" True, **Unless police have assumed a duty to protect you, they don't have one**. “Neither the Constitution nor state law, impose a general duty upon police officers or other government officials to protect individual persons from harm — even when they know the harm will occur,” said Darren L. ""

Does anyone remember the Uvalde massacre? The police stood outside while kids were getting murdered because they were outgunned by one individual. Most of the time the police are not prepared to deal with heavily armed individuals. So if a criminal decided to fuck with you in your home and you don't have a gun, HOW ARE YOU SUPPOSED TO PROTECT YOURSELF WHEN THE PEOPLE YOUR TAX DOLLARS GO TO, PROBABLY CAN'T EVEN PROTECT YOU.

You must take responsibility for the defense of your own life. Now does this mean I don't think there should be any gun laws? No. That would be ridiculous. I want background checks for guns. I want the training required to properly use a gun. Most importantly, I want people to treat guns as a last resort and an extension of their own homes.

**WHEN YOU ARE IN PUBLIC YOU SHOULD RETREAT. WHEN YOU ARE IN YOUR OWN HOME YOU CAN USE WHATEVER WEAPON NECESSARY TO CAUSE THE THREAT TO RETREAT, OR ATTACK THE THREAT IF HE COMES AFTER YOU.**

Seriously, start the legal paper work to get a gun as soon as possible. You can also check your state laws to see if you can carry around pepper spray. Pepper spray is far less lethal and a great defense for anyone who doesn't want to get into fisticuffs with strangers on the street. Men, women, non-binary, it doesn't matter who you are. There is no ""honor"" in this society. Get something to even the odds. There is no ""fight like a man"" for all the men out there, and you can't avoid every conflict through de-escalation, submission, or just talking someone down.

The government literally can't protect everyone. If you can't remember the guy's face, there is nothing the police can do. If there are no witnesses or cameras, nothing the police can do. If the police don't care, you will be screwed.

The democrats you vote for have armed security. Whenever the NRA protests or conservatives protest the police do not try to instigate with them. The police let them protest in peace or try to side with them. The well-regulated militia that the second amendment is supposed to provide has been high jacked by the republican party. They are brainwashed by fox news. At the end of the day they will follow orders and use their guns to make you submit.

**IT IS OKAY TO DEFEND YOURSELF WITH WEAPONS, THAT'S WHAT THE POLICE DO.**",0
"CPAC speaker: ""The comedy channel is liberal news for millennials; the kids believe it.""
*boomer doesn't realize millennials are now 26-42 years old*",0
"Inside Jim Jordan’s Disastrous Search for a ‘Deep State’ Whistleblower Trump officials and GOP lawmakers are working together to deliver on Jordan's promise to reveal an anti-Trump conspiracy. So far, they've produced a 'dumpster fire'",0
"Shame makes people living in poverty more supportive of authoritarianism, study finds",0
Michigan AG says she was among those targeted in threat to kill Jewish members of state government,0
"A state lawmaker suggested ""hanging by a tree"" to execute death row inmates. Now he's apologizing.",0
Trump supporters in plot to firebomb Sacramento Democratic HQ sentenced to prison,0
Alaska Republican touts benefits of children being abused to death,0
"Before slashing Social Security, why don’t we cut 401(k)s?",0
Opinion | Florida Could Start Looking a Lot Like Hungary,0
"Which one should I get?
I’ve wanted a Sig Sauer p365 x macro for a while now but I saw the Walther pdp 4.5f recently and really want it. What do you think?",0
"After Weeks of Fake Outrage Over East Palestine, Republicans Push to Weaken Water Protection",0
"Republicans are not interested in making our lives better. They only want to obstruct government initiatives that help ordinary people, while pushing for initiatives that help corporations and rich people.
I work with a Nevada state agency. The newly elected Nevada governor, republican Joe Lombardo, is making our work very difficult. 

Morale is super low within the agency, and many people who used to be happy to work for the agency are now looking for a different job. 

Republicans only want to obstruct government (unless it’s something that helps them or their friends get richer) and I believe that is the only reason they run for office - to fuck shit up and stop programs that help people. It’s so frustrating that roughly half the country believes their lies and believes they have their best interest.",0
"Tennessee governor appears to have dressed in drag, an art form he wants to restrict",0
"Fox is not news, it’s propaganda",0
Christian Nationalists Are Building a Legislative Machine,0
"Debate Me (I'm bored 😭)
Hello, I'm Aaron, a 16 y/o moderate conservative. I've not been into politics very long but I like to debate people with different views.

Personally I believe there is right and wrong in both sides of the political spectrum equally. Some basic things I support are things like racial equality, same-sex marriages, and improvements to education and social security networks. On the other hand, I believe the second amendment shouldn't be repealed and things like illegal immigration should be looked at more seriously. I believe in complete freedom of religion and speech but I believe no politician should act with religious bias, just as I believe no teacher should act with political bias. I am pro-choice until a few weeks into pregnancy once the embryo begins to properly develope, which then I turn pro-life. The most controversial opinion I have would probably be that I am against trans peoples, as the entire concept doesn't make sense in my eyes. Economically I lean further right than in most things. I believe federal spending should be cut down (See the United States massive debt issue) and in lowering taxes (Or at the very least, putting that money into something useful).

The biggest issue I believe in politics is the massive hypocrisies both sides make, and just how much hatred there is in the system. A compromise is not a bad thing, no matter how hard radicals try to make it seem. 

Well, my thumbs are getting tired, if you disagree anywhere or if I was too vague (I probably was), lemme know what you think and I'll give you my POV.

Thanks, bye. 👋",0
Voters of all stripes sour on Santos,0
"GOP leaders, stung by losses, plan to wade into Senate races",0
"Musk defends ‘Dilbert’ creator, says media is ‘racist against whites’",0
"Elon Musk steps in to Defend Dilbert cartoonist over racist rant, calling media ‘anti-white’",0
Haley vows to strip US aid for countries ‘that hate us’ if elected,0
Voting Rights Act's private right of action is in danger,0
"He deported thousands of people, then learned he was undocumented",0
"Alone and Exploited, Migrant Children Work Brutal Jobs Across the U.S.",0
"I have made an art subreddit that includes all libertarian ideologies and would like to have two moderator representatives from here.
It’s called r/anarchoart. We want it to be an inclusive place for people who are anti-authority.",0
Opinion | Putin and the Right’s Tough-Guy Problem,0
A West Virginia bill allowing concealed guns at colleges is one step away from law,0
"As a trans kid I'm terrified of what conservatives are trying to do to kids like me
I've talked about this before, but I still feel like getting it off my chest, I'm a transgender teenage boy who is hoping to transition soon enough. I'm terrified conservatives will take away that opportunity from me. I don't like worrying about being taken away from my parents because them supporting me is ""child abuse"". I don't want to have to think about being forced to detransition if I do get to transition, I'm just your normal teenage boy who just so happens to be transgender. I love videogames, metal music, comic books, and slasher horror movies. I eventually want a girlfriend to enjoy these things with, too. I'm not any different from any other teenage boy, I'm just a normal kid trying to make it through life. I don't need conservatives trying to make that harder for me.

I'm terrified of what could happen to kids like me.",0
"Poll: Biden's standing improves, while Trump slumps with Republican voters",0
"People can stop paying attention to Trump because it doesn't matter.
Aside from someone turning 18, this man cannot gain a single vote from any adult in the United States at this point. Everyone has made a decision about this idiot years ago. Because of this nothing he says or does matters. None of it needs to be discussed.",0
Voter skepticism of GOP congressional investigations spikes: poll,0
Marianne Williamson is likely to seek the Democratic nomination in 2024. Challenging Joe Biden,0
"I'm really worried that Biden may loose to DeSantis in 2024. Wanted to know other Liberal's thoughts.
I wanted to ask for people's opinion here on something that I am increasingly worried about.

I really like Biden, voted for him in the primary and general, and his approval rating shouldn't be this low considering how well he has led this country through the mess that it has been in since COVID. I'd be just fine with him serving a second term.

But what's most important to me now is that whoever wins in 2024 is a Democrat, not a Republican. If DeSantis wins, with Roe gone, he could pass executive orders to, say, ban millitary healthcare from providing reproductive care, or things like that, all without worrying about a filibuster.

Biden could easily defeat Trump, but DeSantis is a lot smarter, which makes him even worse. In the general, he would probably portray himself as ""a new generation of leadership for the future"" or some nonsense like that. I'm worried that the contrast alone between 82-year old Biden and 40-something DeSantis could prove to be devastating. If the economy hasn't caught up yet it could be even worse. Most voters wouldn't care.

It seems Biden is planning on running again, relying on the same playbook as he did in 2020. So nobody else is challenging him. But this isn't 2020. My best hope, if DeSantis wins the nomination, is that he and Trump tear each other apart and he is forced to go so far to the right on issues that it poisons his chance to win the election.

I'd like to ask for other people's opinion on this. Democrats don't seem to be talking about it much, especially after the midterms, but it is something that REALLY worries me. I like Biden, but I'd rather he end his career on a high note that end up loosing to some freedom-caucus anti-immigrant anti-LGBTQ anti-abortion culture warrior who is only popular because he charters flights from Texas to Massachusetts as some political stunt.

**TLDR**: I like Biden, but I REALLY don't wan't a Repub (like DeSantis) in 2024. I'm not sure Biden is the safest bet to prevent DeSantis or a non-Trump Repub from winning. That worries me. What are your thoughts? Do you agree or am I wrong?",0
What It Looks Like When the Far Right Takes Control of Local Government,0
Republicans use ‘wokeism’ to attack left — but struggle to define it,0
"The Villages
My sister and BIL are about to embark on a 2 week trip touring the villages down in Florida. They’re plan is to decide if they wanna live there and retire as snow birds (we live in NYS). They’re both trump supporters, unfortunately. Anyone know what it’s like down there? Will they come back even more hateful than they already are or am I worrying for nothing?",0
