text,label
"Grammy induced conservative aneurysms.
Sorry if this is not the best sub for this.

Just a thought about the Grammy freakout. All of this indignation over non binary and trans performers and also apparently just wearing the color red (sweet irony) makes me wonder why NOT ONE of them has raised the flag of outrage that Chris Brown was nominated for an award. So, they don't care about an artist with multiple violent felony convictions being honored but devil horns are going to summon Satan himself to drag us all to hell? My goodness.

Also, seems none of them have anything to say about the utter devastation in Turkey and Syria.",0
"Neo-Nazi leader and Maryland woman allegedly plotted to 'completely destroy' Baltimore, Justice Department says",0
"Without liberalism, LGBT rights would not exist. And without liberalism, they have no future.",0
"South Carolina Dem James Clyburn funneled six figures from campaign funds to family last cycle, filings show",0
"Lessons learned.
 

To the members of the Republican Congress: 

 Let me tell you what was learned from Trump: To be bitter and spiteful, to set aside good nature in pursuit of revenge, to be unrelenting and implacable in demanding the prosecution of our representatives who tried to nullify eighty-one million votes and put a tyrant in office. 

Yes, joy was discovered in the sins of vindictiveness and retaliation. 

All the ammunition needed for this pursuit has been provided to the Justice Department by the Select Committee and, as in hearing after hearing, they learned the names of the authors and the plan of sedition and heard it from Republicans themselves. 

For only the second time in history, some Americans turned against, and betrayed their country, and for this they will be harshly punished. 

There will be only fitful sleep for these traitors. They are now quaking with trepidation, fearing the moment when their names will be mentioned, and their crimes exposed. Fearing the condemning glance of their family members who will live in shame for generations, fearing the inevitable bankruptcy caused by predatory lawyers and the huge fines they face, and fearing being imprisoned with hardened criminals who will use them as sex toys. 

And for what? Influence, prestige, money, the affirmation of like-minded scum? Hardly a good trade-off. 

As mentioned, there are at least eighty-one million Democrats, plus loyal, patriotic American Republican and Independent voters, and the insurrectionists will feel the weight of unwavering might. 

Don’t think it is only the worst of the worst will be targeted. The Jordans, the Hawleys, the Gosars, et al. Each and every opportunist who voted to set aside the results of a legitimate election will also feel the pain of wrath. It may take some time --  ‘the wheels of justice turn slowly, but grind exceedingly fine’. 

Tick-Tock...",0
"Does most of the Tesla employees support republican?
Does most of the Tesla employees support republican?",0
"Republicans are blaming Biden for letting a suspected Chinese spy balloon cross into the US. It happened 3 times during the Trump administration, officials say.",0
"If you had cancer, got Covid, and died, it wasn't cancer that killed you.
&#x200B;

Have you ever wondered how life insurance companies make so much money? The simple answer is they don’t gamble, they use statistics to formulate their rates, statistics reflecting the actual number of deaths from any given disease (cancer, heart disease, diabetes, etc.) These statistics are reflected in charts called *actuarial tables* and they can predict with super accuracy how many people in the United States will die from any specific disease, in any given year. 

The US government uses these same types of charts to keep the CDC and other agencies up to date with a similar formula. 

There seems to be a contrarian streak in many people, a refusal to accept verifiable facts -- despite all the evidence – and they remain resolute in their obduracy and firm in their unfounded convictions, 

Perhaps they think it makes them seem smart, well-informed and it gives them a sense of pleasure to stick their finger in the eye of conventional belief; *whatever.* 

A common example of this syndrome are right-wing claims that reported deaths from Covid are exaggerated, that many deaths caused by other diseases, even accidents, are attributed to Covid. Why they choose to believe this with no evidence to back it up, is beyond me; but again, *whatever.* 

To refute this silliness, I point to a government study in July of ‘21 that clearly shows in the period between Feb. of ‘20 and Jan. ‘21 there were 100,000 deaths that couldn’t be attributed to anything other than Covid. 

Statistics, tables, facts, believe what you want.",0
"Raising wages
My friend was saying that since places like McDonald’s are franchises, when wages are raised the money isn’t coming from a giant corporation but from the franchise owner. When I googled how much the average franchise owner makes, it said $150,000. 
I’m all about paying a living wage, but I didn’t know how to counter her argument because of the franchisee that stands between the worker and the rich corporation. Can anyone help me support raising wages within her point about the franchise owner?",0
"Republican legislators...
&#x200B;

The average ten-year-old girl weighs seventy pounds. The average weight of a baby born in the United States is between six and eight pounds. The average height of a ten-year-old girl is four feet six inches. The average circumference of a newborn's head is thirteen inches; You know where I'm going with this, you've witnessed the birthing process, you've heard the screams of agony. Yet you, the right to lifers’ have mandated a ten-year-old girl force through her undeveloped birthing canal and her unyielding vaginal opening to a baby that is approximately ten percent of her weight, and approximately one third of her height. 

 A ten-year-old girl! 

Picture that child in your mind – Picture it! 

Conservative Republican politicians, we've long suspected your hypocrisy, your sometime repulsive penchant to display your dishonor by lying about any matter to reinforce your warped political views, but nothing ever as demented as this. 

That you fear the wrath of the misguided and ultra-radical whackos who have taken over your party more than the pain of your own conscience shows just how low you have sunk. 

If this was your ten-year-old daughter, no matter what laws you helped pass, if she was pregnant, you’d have her on a plane to a state where abortion is legal at the first diagnosis. 

Listen to the screams.",0
The Violent Far-Right Terrorist Threat to the U.S. Military,0
Trump Offers $1 Million Bond to Appeal Clinton Suit Sanctions,0
"why does Barney Frank waste his time as a recurring guest on Newsmax?
They pair him with one of their biggest trolls: Daily Caller writer Kay Smythe. She's so cringe. They consistently cut off Barney midsentence so it devolves into a flustered 80 year old man and snickering witches.

I'm sure 99% of the viewership loves it. Own the libz!!",0
Seriously all because trump lost? Very sad,0
"Are Slander Lawsuits the Answer?
In the past, when politicians weren't so brazen in their lies about their political opponents, it was considered unseemly to pursue legal action for libel and slander against political opponents.  The courts provided a **lot** of latitude in political discourse that was tangential to the truth.  In those times, that made sense.  We don't live in those times.  


In these MAGA times, we see Trump accusing the Capitol Police Officer who shot Ashli Babbit of being a ""thug,"" ""misfit,"" and a ""coward"" and intimated that he was a murderer.  Marjorie Taylor Greene also asserted that Babbitt was murdered.  


Is it time to set up a PAC that would fund slander and libel lawsuits against those who lie when the truth is readily available?",0
"DAE watch Scripps News (fka Newsy), France 24, or NewsNet?
mediabiasfactcheck.com rates all as 'high' for factual reporting. Scripps is 'left-center' bias, while France 24 and NewsNet get the coveted 'least biased'.

NewsNet has been described as taking the torch from what HLN (Headline News) once was.

France 24 is an English-language straight-forward news outlet. Boring compared to other ""cable news"" networks,
but informative. (I put ""cable news"" in quotes because these networks are meant to compete with MSNBC, CNN, Fox News, etc, but they aren't relegated to cable.)

I think all are available as free livestreams.

I believe Reuters also has a TV network, which would likely be as highly factual and unbiased as their syndicated news is.",0
"Public money for public schools.
If one had to point to a single issue as to what made America great, it just might be our public school education system. It guarantees every child the opportunity to advance at one’s own level with no restriction on what one might achieve, providing they have the ability to maintain reasonable standards of productivity. 

Even though America’s most challenging period, Jim Crow, when black children were segregated and shunted aside to ‘Separate, but equal’ schools, (Which were separate, but not at all equal) a basic level of learning was realized. 

*Public* funding (tax dollars) provided the wherewithal to fund *public* *schools,* and although challenged by problems that beset any large institution it did achieve, according to the Census Bureau, a literacy rate of 86%, at near the top of all the nations of the world. 

But now a dual education proposal is challenging the public system all across America; the threat? Vouchers! 

The scheme is as simple as this. The proponents intend to siphon off tax dollars meant for public education and divert it to private academies and prep schools that cater to the well-to-do, and the wealthy. They hire public relations firms to concoct ridiculous stories about a grassroots movement supporting the plot, when in fact right-wing plutocrats fund the program in order to further the separations between the rich and the poor. 

Each day we read about heroic, *underpaid,* teachers and administrators reaching into their own pockets just to provide the basics, pencils, and paper, for their already underfunded schools. But now, with pristine arrogance, and even before those items can be procured, they want the public dollars to go to travel lacrosse teams and racing shells for their already privileged children. 

And to make matters worse, there is no accountability for those funds. Whereas public schools have to meet certain standards of learning, give tests, adhere to standards, and face sanctions if goals aren’t reached, no such rules apply to most voucher projects. 

*Public* tax dollars for *public* schools and not for the enrichment of *private* institutions!",0
"US adds a surprisingly strong 517,000 jobs despite Fed hikes",0
"Maxine Waters Had The Perfect One Word Response To GOPer's Gotcha Question About Foreign Dictators 🤯
 **Reschenthaler invoked the names of foreign dictators and asked Waters:**

>*""You know what Putin, Kim Jong Un and Xi have in common, right?""*

But he did not get the response he was setting her up for, which was communism.

**In response to what the three dictators Reschenthaler mentioned had in common, Waters simply replied:**

>*""Trump.""*

[https://secondnexus.com/maxine-waters-reschenthaler-trump-response](https://secondnexus.com/maxine-waters-reschenthaler-trump-response)",0
Human rights activist warns of abuses in Congo cobalt mines: Moral clock dialed back to colonial times,0
Ohio's education department is investigating a White supremacist homeschooling network that shares Nazi-related resources,0
"How many liberals ""hate-watch"" Newsmax and/or Fox News?
I'm a registered Democrat and generally have liberal views across the board, socially and economically.

That said, I became fascinated by disinformation in 2020 and sought out the ""least biased"" news. I landed on PBS NewsHour and, to a lesser extent, NPR as well. (Though, I may be biased to the digestibility that is NewsHour's tidy hour-long nightly newscast M-F, and an easy 30 minutes that is NewsHour Weekend on Sat and Sun. I suppose there's a reason that NewsHour is the longest-running American news program, going strong for nearly 50 years.)

I also discovered www.mediabiasfactcheck.com, which is amateur but informative.

I'll turn on Newsmax in order to know exactly what drek they're promoting. With the recent hubbub of DirecTV dropping Newsmax 1 year after they dropped OANN, I noticed the same talking points were being parroted over and over again, in particular by R congressmen, that DirecTV carries ""22 liberal channels"", which supposedly dwarfs the number of conservative networks.

I've attempted to find this list of 22 channels but have come up empty. It's true that the mainstream news channels skew slightly left-center, but I wouldn't call CBS, ABC, and NBC intrinsically ""liberal"".
 I can only presume they're counting channels like C-SPAN and ESPN.

Is there a better subreddit to discuss the factuality of news that isn't of a particular political stripe? I can't even find a subreddit for real-time discussion of live or breaking news. R/findareddit turned up nada.",0
"What does it mean to be a Liberal in 2023?
If you asked me if I was a liberal six or seven years ago I would have immediately answered yes. If you asked me now I wouldn't be so sure. I also wouldn't consider myself a centrist. 

Both sides of the political spectrum seem to be getting more extreme. I feel like on either side you can't so much as even question why someone holds a certain view without being called a bigot (if you question the left) or woke (if you question the right). Even if the question comes from a place of attempting to understand/deepen understanding rather than challenging.

I like to discuss and hear different points of view even if they are something I might consider offensive or incorrect I still will listen to it. Because then I might be able put across my point of view more effectively and they will be more likely to listen. And also I've heard some things that sound bad at first when explained make sense.

So I'm curious. What does it mean to be a liberal?",0
Satanic Temple Opens Abortion Clinic Named “The Samuel Alito’s Mom’s Abortion Clinic”,0
"US Medicare and Medicaid Reform
**I’m conducting a short survey on US Political Stances on Medicare and Medicaid reform for my school research and I would really appreciate it if you could spare a minute to take it!**

&#x200B;

[https://docs.google.com/forms/d/e/1FAIpQLSe9Y7RgODwryPs4aT0UmeMt9vnLTIT-ueASMOKbFj4JBrBLDQ/viewform](https://docs.google.com/forms/d/e/1FAIpQLSe9Y7RgODwryPs4aT0UmeMt9vnLTIT-ueASMOKbFj4JBrBLDQ/viewform)",0
"THE WHEELS OF JUSTICE...
These are long days and torturous nights for Paul Gosar and Kelli Ward, both of whom have shown support for the insurrectionists at the United States Capitol.  

The Justice Department is deep into multiple investigations, investigations bolstered by evidence provided by the Jan. 6th Committee of the failed coup attempt, and they now possess a ‘landslide of evidence 'most of which comes from cell phones seized by the FBI.  

They have recovered a treasure-trove of information from the phones of Giuliani, Eastman, Scott Perry, Mike Lindell, Boris Eashteyn, Victoria Toensing, (both Giuliani advisors) Michael McDonald, and Jeffrey Clarke, just to name a few. 

For a few brief moments this week, the sugar plums of sedition again danced in congressional heads when the courts issued a hold on Scott Perry’s phone. Ah, but the funny thing about telephones is they are two-way devices. 

In the heat of the insurrection phone calls, text messages, and emails flew about the government like newspapers on a New York City Street in a windstorm, but unlike the newspapers, these have been collected, collated. and compiled into binders related to specific schemes and to specific personages, to overthrow our democracy. 

Schemes like mounting a concerted effort to invalidate a legitimate vote, schemes like falsifying a slate of phony electors to change the vote, and most insidious of all, a scheme to replace a recalcitrant Attorney General with a stooge who would claim he sees irregularities in the election and will have the military seize the voting machines where, God knows, what would be done to them. 

Yes, there are heavy heads on pillows as the Justice Department completes its mission. Gosar and Ward aren’t the only ones sleeping a fitful sleep, they are joined by Mo Brooks, Louie Gohmert, Matt Gaetz, Andy Biggs, Josh Hawley, Marjorie Taylor Greene, Mark Meadows, Jim Jordan, Tom Cotton, Mike Lee, Lauren Boebert, Jim Banks, and others in their sweat-soaked tossing and turning. 

It’s taking some time, but you know what they say about the wheels of Justice.",0
We all need to MAKE SURE that this person does not make it to the White House,0
The Latest Crusade to Place Religion Over the Rest of Civil Society,0
Rep. George Santos says he will recuse himself from committee assignments amid ethics issues,0
Supreme Court denies disabled veterans compensation in its first ruling of the term,0
"What does it mean to be a liberal?
I’m interested in the variance of thoughts on what it means to be a liberal. I consider myself a liberal. What does it mean to you?",0
"In Uganda, the president's son is getting ready to run | Semafor",0
Trump’s Killing Spree,0
"THE RED RIPPLE.
First, they expected a tsunami, a comber of explosive force that would wash away truth, logic, and integrity. But then they were forced to downgrade their expectations when their absurdities were met with derision and none but the disaffected and deranged applauded their efforts.

They gave up on the tsunami and settled on the ‘Red Wave’.

The ‘Red Wave’ did make it to the shoreline, but instead of a tidal wave of raging surf, it crept in, all a swell of sea foam and mist. It did drag in the flotsam and jetsam of irrationality and outright lies, but never made it far up the shoreline where a phalanx of sandcastles built by Generation Z rebuffed it with ease.

‘Gen Z’, better than 30% of the electorate by 2024, (11,000 of whom become eligible to vote every day; guess who they are supporting?) are just beginning to dip their toes into national politics but have already become a force of rationality and reason – they are offended by the absurdity of your lies and insulted by your condescension – and there are more of them every day.",0
"How do you feel about shows like Bad girls club?
How do you feel about reality shows like Bgc and Love and hip hop?",0
George Santos Is a Model Republican,0
"“Reason may help us win minds, but to win hearts, we must speak from the heart.”",0
"SICK of Trump supporters
I wanted get your guys take on these disney Donald Duck supporters (this is just a metaphor because I HATE saying this guy's name).

What do you do when you explain all the horrible, racist, xenophobic things he has said and done, and they're just like ""oh well where's the proof"".

I JUST TOLD YOU WERE YOU NOT LISTENING.
I'm sick of these yeehaw redneck toyota tacoma drivin truckers who listen to these CONSERVATIVE BIASED new stations, and use that as proof!

Do you have any suggestions on how to bait them, because I'm talking to this trumpy on facebook, and I want to OBLITERATE his argument.",0
"App to help you identify local businesses to not support
One of my far-right relatives was bragging about the app “public square” which is a place where “freedom supporting” (aka pro forced birth, anti-vax, etc) businesses can self register as such so that other conservatives can support them. 

Pro tip, the app works just as good for showing people who do not support these ideologies some good places to NOT support. I felt embarrassed having it on my phone but I downloaded it briefly and was surprised to see a few restaurants I had been to before.",0
"WHEN FOXES RULE THE HEN HOUSE.
 

An overwhelming number of Republicans want the House to address issues important to them. During the midterms promises were made that the matter of inflation, crime, and the southern border would be center-stage and a bi-partisan effort would be made to correct these problems. 

Do you want to know what happened to those promises? the whackos took over and are now promising us a new wave of Benghazi-like investigations, and like the eight Benghazi (Costing some seven million dollars) nothing will come of them except the opportunity to try and embarrass President Biden. 

Eight separate tribunals, seven million dollars, and at the end of the fiasco, Hillary, sitting alone and without benefit of counsel -- over the course of twelve hours -- answered all their questions and figuratively spat in their eye! 

Chairman Gowdy finally admitted nothing was accomplished by the two-year, four-month investigation. 

Now they are up to it again. 

Representatives who themselves are now under investigation by the FBI (Jim Jordan, who sat on the Benghazi committee) want to investigate the FBI. That’s like having Benedict Arnold sitting on his own jury or allowing George Santos to swear to the veracity of the witnesses. 

Maybe the FBI should be investigated, they are proving to be a real nuisance to Chinese spy rings, corporate crime (Their just announced indictment of Google), and political corruption, to say nothing of their investigation of 1/6 and the self-same Republican Representatives alleged to have been involved in the attempted coup. 

Oh, do you think...?",0
How Wisconsin’s Spring Election Will Impact Your Life for the Next 10+ Years,0
"My thoughts and prayers go out to all the children being taught by pink haired communists. That's how you solve major problems in school, right?",0
"Federal prosecutors discussed charging Trump in Stormy Daniels case when he left office, book says | CNN Politics",0
Tyre Nichols death: Memphis braces for protests when police body cam footage is released,0
"Rep. Adam Schiff announces 2024 Senate run, teeing up a high-profile primary",0
Tigrayan Struggle Continues,0
"Trump claimed victory at a weekend-long golf tournament despite missing half the play
https://sports.yahoo.com/trump-pilloried-4-old-cheat-080846940.html",0
G.O.P. State Lawmakers Push a Growing Wave of Anti-Transgender Bills,0
"[Hayek, Friedmann, Classic Liberal Theory] Are there valid reasons to subsidies Energycosts for consumers
Hey friends,

Context:

• In Germany we have introduced subsidies to cap gas prices to 12ct per united for consumers. The difference between market price and the 12ct per unit is payed for by tax-money.

• To incentivise conserving gas, this mechanism only works up to 80% (insentive: Safe 20%) of your gas-use in 2022. What is above that needs to be payed for by the consumer alone.

• Providers are legally forced to explain any rise in their retail price on gas in 2023 in fine detail, so that they can't artificially rise them to get more subsidies.

• There is no legal mechanism that forces providers to lower their prices.

In effect:

• This lowers the effective gas-costs for consumers on their bill, which is good.

• This uses up enourmous amounts of taxpayer money, which is reasonably bad.

• This eradicates any incentive for customers to seek out a (slightly) cheaper gas providers, which is bad. (Reason: Doesn't matter to you, as you pay 12cents max per unit either way. And it's unlikely anyone can provide for lower)

• It takes most incentives away from providers to lower their prices (because consumers don't really care), which is bad.

• This encourages providers to keep their prices high (as this grants them more € per subsidised unit), which is bad.

The question:

• When we look at classic liberal theory, can there be an argument for any sort of ""gas-price-break"" as it's called? Maybe a very low conservative cap at 50% of your former gas-use to uphold market pressures while also sustaining (more) buying power and general situation of the people?

• What is the outlook for the economy if no subsidues are introduced? Lower prices but effectively more burden on consumers. Where are consumers supposed to get that money from? Bank loans or liquidating posessions? -> Is there a limit where the government should intervene before people fall into poverty (in classic liberal theory)?

• Extra: Maybe any specific chapters I should read into?

&#x200B;

Thanks for your time an effort!",0
There is NOTHING more American than firing the superintendent of a district because a 6-year-old brought a gun to school and shot a teacher. It's a Masters Class of a solution amirite?,0
Is Right Wing Media Poisoning the GOP? With Matt K. Lewis of The Daily Beast,0
"What are conservative triggers besides ""woke"" M&Ms?
I'm trying to be better at understanding what triggers conservatives. Let's make a list.",0
A North Dakota Bill Would Fine State Employees for Respecting Trans Peoples’ Pronouns,0
