text,label
The Democrats Need to Destroy Clarence Thomas’s Reputation: They’ll never successfully impeach him. But so what? Make him a metaphor for every insidious thing the far right has done to this country.,0
Biden tells Al Roker: ‘I plan on running’,0
Florida is OUT OF HAND!,0
Easter Sunday Brings Thousands to ‘Drag March’ in Los Angeles,0
There's a new group helping trans people flee Republican-led persecution in the US,0
GOP warms to Trump's plan to bomb Mexico,0
Wish he'd just resign,0
"Fewer pronouns, more guns: Ron DeSantis’s plan to turn the US into Florida",0
Robert Kennedy Jr to make 2024 Democratic presidential bid,0
"Will Gavin Newsom run for president? Experts say it’s not if, but when",0
"In Ron DeSantis’ shadow, Florida Democrats fight to be relevant",0
"Clarence Thomas' Billionaire Buddy Has a Vast Collection of Hitler Paintings, Nazi Memorabilia",0
Democratic Sen. Bob Casey Of Pennsylvania To Seek 4th Term,0
I thought you all would appreciate this! 🇺🇸🇺🇸🇺🇸,0
Nashville to vote to reinstate Tennessee lawmaker expelled for gun control protest,0
stephen king writes truth instead of fiction here.,0
Democratic Sen. Bob Casey of Pennsylvania to seek 4th term,0
TFFG is done. Now we must get out and vote in '24. Especially the young voters.,0
Biden-Harris Administration Proposes to Strengthen the Mercury and Air Toxics Standards for Power Plants | US EPA,0
Senator Mazie Hirono: 'We are going to have hearings' into paid trips taken by Justice Clarence Thomas,0
A settlement has been reached in a Venezuelan businessman’s defamation lawsuit against Fox News and host Lou Dobbs over statements accusing him of helping tilt the 2020 presidential election.,0
"Becky, a trans student, just had a major win in her fight against a sport participation ban",0
Proud to be a Catholic Democrat! #biden2024,0
Tennessee GOP Lawmaker Once Called Expelled Rep a ‘Baboon’: Report,0
"Scott Walker blames young voters for GOP's losses in Wisconsin, but offers few solutions for winning them back",0
"Texas governor pushes pardon of man convicted of protester killing.Perry killed Foster, an Air Force veteran who was legally armed, during an altercation at an Austin BLM protest.",0
Texas governor seeks to pardon Army sergeant convicted of murder,0
"Clarence Thomas' benefactor, the billionaire megadonor Harlan Crow, has a collection of Hitler artifacts and Nazi memorabilia.",0
"Iowa won't pay for rape victims' abortions or contraceptives The Iowa Attorney General’s Office has paused its practice of paying for emergency contraception, and in rare cases abortions, for victims of sexual assault",0
Our future if we don’t vote.,0
Popular opinion,0
Democrats blast Texas abortion pill ruling as Republicans are mostly quiet,0
"Justin Pearson is the next generation of leadership we need.
Feel free to use and share. This is my original artwork.",0
Push this narrative re DeSantis vs Disney,0
#biden-harris2024,0
Good Trouble,0
Glad the GQP has switched from Bud to Coors.,0
Clarence Thomas’s Billionaire Benefactor Collects Hitler Artifacts,0
Gun deaths among U.S. children and teens rose 50% in two years,0
McCarthy faces GOP blowback after N.Y. Times leak,0
"Trump-Appointed Judge Bans the Abortion Pill Nationwide, Starting in 7 Days",0
Democrats ask chief justice to investigate Clarence Thomas trips: ‘It is your duty’,0
How’s that switch from Bud to Coors going? 🏳️‍🌈,0
"Should focus of Democrats in the upcoming election be saving the US from becoming a Christian theocracy? Because that is what Republicans are trying to do
We see the evangelical cult hijacking the Republican party and imposing their religious beliefs upon society. First they targeted women’s right to choose, now they are targeting the LGBT community, all in the name of Christianity. They claim Christians are targeted. The whole US is sick of Christofascism and religious zealotry. The Democrat main focus should be fight against Christian theocracy, and return to Medieval church dominance. The people of the US are generally against Christofascism and religious dominance, they want secular state. The Democrats need to make sure people are aware that Republicans want Christian theocracy and their main focus should be fighting against it.",0
A once reluctant Harris embraces her biracial identity in Africa,0
GOP tries hard to differentiate itself from KKK but it’s not easy,0
"Clarence Thomas’s Billionaire Benefactor Collects Hitler Artifacts - Washingtonian
Nothing to see here.",0
Here’s looking at you lawless Florida. What could go wrong?,0
"Tesla workers shared sensitive images recorded by customers' cars, former employees say. But between 2019 and 2022, groups of Tesla employees privately shared via an internal messaging system sometimes highly invasive videos and images recorded by customers' car cameras,",0
Racist Republicans violated TN Constitution when they removed two duly elected black men for protesting to protect children aginst gun violence,0
Expelled Tennessee House Dem Could Be Reinstated Almost Immediately,0
"Florida officials deleted data, stats from dubious COVID analysis: report",0
Texas judge halts FDA approval of abortion pill 😡,0
"Russia's 'Merchant of Death Warns Donald Trump His Life Is in Danger, Offers refuge in Russia.",0
Christofascist claims it is her religious right to discriminate against trans people,0
Why America should never forget the Tennessee House expulsion of 2 Democrats over gun protes,0
North Dakota senators vote to boost their own meal reimbursements after rejecting free school lunch bill .Thirteen Republican senators voted to increase meal reimbursements for state employees after voting against a bill to expand free school lunches for low-income students.,0
"AR Rep. Kolodin states he will shoot anyone who tries to take away his ""right"" to circumcise his child.",0
Abortion Pill to Be Blocked Nationwide Under Judge’s Order,0
"'Self-serving' North Dakota GOP boosts own meal allowance after axing free school lunch bill
There is a special place in hell for these turd nuggets.",0
Politicians May Get a Free Pass Under Meta's AI-Generated Fake Image Rules,0
We need to stop the TN and FL GQP.,0
Trump Makes Himself 2 Inches Taller In Fake Mugshot That Fundraises Off Arrest,0
Trump Makes Himself 2 Inches Taller In Fake Mugshot That Fundraises Off Arrest,0
"Live updates: Texas abortion pill ruling
A Texas district judge knows he has overstepped his authority. The product of a right wing law firm known as aggressive anti-abortionists pursuing this end for years, affects the entire country from an Amarillo, TX courtroom. Biden-Harris administration must respond within 7 days. This.Is.Insane.",0
White Fragility Is Poison,0
Maybe Disney can keep him so busy trying to get petty vengeance he won't have time to try to mount a presidential campaign.,0
"""The groomer of beers"": Conservatives vow to boycott Bud Light over partnership with trans activist",0
[Top Stories] - Opinion: The Clarence Thomas revelations are the last straw. It's time for Congress to act,0
"DeSantis: I’ll kill Reedy Creek deal, consider hotel tax, tolls for Disney World",0
"McDonald's gross profit for the twelve months ending December 31, 2022 was $13.207B, a 4.98% increase year-over-year.",0
Call your representatives. All of your representatives.,0
"Florida GOP launches ""Blue County Strategy Committee"" to ""pick off"" Democrat-held seats at every level of government; goal is ""no Democrats in office or considering running for office in the State of Florida""",0
Trump forced to admit he is one inch shorter than he claims on arraignment paperwork,0
Hermes Knows What's Up in Tennessee,0
"Most oppose Social Security, Medicare cuts: AP-NORC poll",0
White House Announces Crisis Hotline for LGBTQ+ Youth,0
Yachting and private jets: This US Supreme Court judge is under fire for 'cartoonish' behaviour,0
The Future of Republican Governance is on Display in Tennessee,0
California Senate contenders haul in millions in first quarter,0
Tennessee Home of Progressive Journalist Shot at While Family Slept,0
The GOP's epic losing streak,0
"TN Speaker, Who Refused to Remove Republican Accused of Child Sexual Abuse, Moves to Expel Three Dems Over Gun Violence Protest",0
Call Tennessee House Speaker Cameron Sexton to express your concerns,0
"Biden's 2022 Remarks Not Related to Trump Indictment, Contrary to Online Posts - FactCheck.org",0
"The absolute hypocrisy you'll hear in these audio recordings of ""simple man"" Clarence Thomas",0
Norway helped remake a US prison. Here’s what happened.,0
"Treasury, IRS Release Plan to Deliver Improved Service for Americans, Reduce Deficit by Hundreds of Billions by improving enforcement among high-income and high-wealth individuals, complex partnerships, and large corporations that are not paying the taxes they owe",0
Nailed it,0
"We Know Brett Kavanaugh Won't Be Drinking Bud Light Anytime Soon
xpost with r/wokefuturama",0
2023 Wisconsin Supreme Court election treemap,0
"Steve Bannon spent ""months"" recruiting anti-vaxxer RFK Jr. to run against Biden as ""chaos agent""",0
Painting that hangs at Camp Topridge showing Clarence Thomas on a luxury trip paid for by a billionaire who invited along conservative lobbyists.,0
Death of democracy through open racism.,0
"Tennessee GOP expels 2 black Democratic lawmakers, fails to remove another the white Democratic over gun protest.",0
"Freedom Caucus and progressives lock arms — and that could be bad news for McCarthy | The speaker’s immediate headache is a growing right-left alliance on Iraq war powers. But House liberals and conservatives are linking up on other issues, too.",0
Rep. Justin J. Pearson Expelled From Tennessee House.,0
"Steve Bannon spent ""months"" recruiting anti-vaxxer RFK Jr. to run against Biden as ""chaos agent""",0
Donald Trump is obsessed with sharks and 'hopes they all die',0
Biden issues second veto of presidency to save his administration's hallmark water rule -,0
How is this even legal?,0
‘God knows what they are doing.’ Clark Township racism scandal unresolved a year after revelations,0
Clarence Thomas on a luxury trip paid for by a billionaire who invited conservative lobbyists.,0
"Working on designing graphics in my spare time. Got a bunch of input from my last post. This is my ""final draft"".",0
Nedry and Kid Rock having lunch.,0
Tennessee lawmakers expel first of three Democrats over mass shooting protest,0
Foolish Tennessee Republicans elevate 3 Democrats to martyr status & political stardom,0
Rep. Justin Jones Expelled from Tennessee House,0
Ohio Supreme Court Reviews Trans Woman's Request to Adjust Birth Certificate,0
"Supreme Court Rules in Favor of Transgender Student, Blocks West Virginia Sports Ban",0
Supreme Court Rules for Transgender Girl in School Sports Dispute,0
Abortion Wins Elections,0
I'm working on creating graphics and looking for constructive criticism on content and design. What do you think?,0
Franklin County Ohio Senate elections in 2010 and 2022,0
Bill targeting Tester U.S. Senate race passes Montana Senate,0
Impeach Thomas.,0
"Clarence Thomas has accepted undisclosed luxury trips from GOP megadonor for decades, report says",0
"GOP budget
Can anyone tell me what the actual GOP budget plan is besides just we’re making cuts? Because I have family who is fighting with me that if we default it’s because democrats didn’t approve a plan that doesn’t exist because democrats made a plan to just raise the ceiling.",0
Federalist Society founder Leonard Leo accused of misusing $73m from nonprofit groups,0
Clarence Thomas Secretly Accepted Luxury Trips From Major GOP Donor,0
Clarence Thomas Secretly Accepted Luxury Trips From Major GOP Donor,0
Mom’s Interview With Anti-Trans Media Draws Criticism After Teen Responds,0
TN: Democrats introduce gun legislation after The Covenant School shooting,0
a cruel irony,0
Report Details 'Staggering' Church Sex Abuse In Maryland More than 150 Catholic priests and others associated with the Archdiocese of Baltimore sexually abused more than 600 children over the past 80 years.,0
Trump’s Day of Martyrdom Didn’t Go Quite as He Expected,0
Trump joins other Republicans in pushing to ‘defund the FBI’,0
"Gov. Reeves Declares Confederate Heritage Month, A 30-Year-Old Mississippi Tradition",0
"DeSantis is turning into an Autocrat. Florida is letting him: ""Ron DeSantis had his political opponent and head of the Florida Democratic Party arrested tonight. This should be a national story.""",0
Republicans are now running as Democrats to rig elections,0
"Bernice King, daughter of Martin Luther King Jr., calls for permanent school walkouts until gun control passes",0
Robert F. Kennedy Jr. files paperwork to run for president as a Democrat | CNN Politics,0
"r/inthenews on Reddit: Donald Trump isn't the first Trump to get arrested. His father, Fred, was arrested twice, reports say — once at a Ku Klux Klan riot, and another time over building code violations.",0
"In a new low for the GOP, Tricia Cotham expected to change parties after being elected as a Democrat, granting the NC Republican legislature unfettered power",0
Gwinnett County Georgia 2004 - 2020,0
He won’t be framing this one! Lol,0
That was a big !,0
Fact check: Trump delivers barrage of false claims in first post-indictment address,0
The rotting of Donald J. Trump,0
[Local] - Newsom heading to Florida college that DeSantis wants to take over,0
Trump’s trial is on a collision course with the start of the GOP presidential primaries,0
"Where does the real ""grooming"" take place? At the dinner table where right wing parents indoctrinate their kids with racism/homophobia/anti-semitism and other toxic RWNJ crap.",0
New Jersey Governor Declares State a 'Safe Haven' for Gender-Affirming Care,0
Justice Janet Protasiewicz 🏆,0
Florida Democrats Troll DeSantis By Trying To Ban His Book,0
Is it 2008 all over again?,0
Schumer to speak at 4/20 cannabis policy forum inside the U.S. Capitol alongside other lawmakers,0
Yahoo! Front page this morning,0
Democrats Take Control Of Wisconsin Supreme Court,0
Florida Democrats charged after abortion rights protest,0
"A 2% Win in Wisconsin is a Landslide. This ""Liberal Judge"" Won by 10%. What Does That Tell Us Moving Forward?",0
"Progressive Brandon Johnson will be elected Chicago mayor, succeeding Lori Lightfoot",0
Liberal judge wins in Wisconsin Supreme Court showdown,0
"Gov. Inslee buys 3-year supply of abortion pills in case of ban | The Washington governor announced Tuesday that he plans to stockpile 30,000 courses to hedge against a possible federal ban.",0
Huge victory!,0
How the court illustrator captured the former president during today's arraignment in New York. I think they captured his dead eyed stare and soulless demeanor.,0
Complete details of charges,0
"Liberal Wins Wisconsin Court Race, in Victory for Abortion Rights Backers",0
"""Gentlemen, this is democracy manifest. Get your hand off my extremist!""",0
"Liberal Wins Wisconsin Court Race, in Victory for Abortion Rights Backers",0
We win in Wisconsin.,0
Liberals gain control of the Wisconsin state Supreme Court for the first time in 15 years,0
Stacked: Where Criminal Charge Stacking Happens — And Where it Doesn’t,0
"North Carolina Democrat Plans to Switch Parties, Allowing Republicans to Ban Abortion
Traitor.",0
First time I saw Melania smile.,0
"NC House Democrat to switch parties, creating GOP supermajority
Meanwhile in North Carolina, a House Democrat will be switching to the GOP, now creating supermajorities in both chambers of the state legislature.

Governor Cooper’s vetos will no longer be able to be defended and it’s only a matter of time before the NC GOP starts going after the drag shows, abortion access, gender affirming care, etc.",0
Stormy Daniels on the Trump Indictment and What Really Happened in That Nevada Hotel Room,0
Chaos Erupts as George Santos and Marjorie Taylor Greene Appear Outside Trump Arraignment,0
Beautiful 😚👌🏻,0
So gross - “authentic leadership”,0
LGBTQ+ Veterans Stand Up to Far-Right Extremism in Texas,0
34 FELONY COUNTS?!!! HAHAHAHAHA HOLY FUCKING SHIT!!!,0
Hey. Just woke up. Anything happening in the country? I know...just more boring news.,0
Stormy Weather,0
"Democrats troll Ron DeSantis with calls to ban his own book from Florida schools. His book talks about violence, gender identity, and other controversial topics. How is this book still in Florida schools?",0
He said who is fake news???,0
California districts in the 2024 crosshairs,0
Donal Trump arrives at NY court for arraignment,0
After Fingerprints and On His Way to Arraignment. Good Times!,0
Marjorie Taylor Greene Whisked Away By Security At Protest Against Trump’s Indictment Outside Manhattan Criminal Court,0
"Wisconsin voters cast ballots in crucial state supreme court election — Abortion, election rules, legislative maps at stake in most expensive judicial race in US history",0
House GOP's Biden investigations sputter out of the gate,0
DeSantis is trying to place himself as an Autocrat. Florida is letting him.,0
DeSantis to expand 'Don't Say Gay' law to all grades | AP News,0
"Over Democrats’ Objections, Texas GOP Votes to Halt Gender-Affirming Care for Existing Patients",0
Former Hogan aide Roy McGrath dead after confrontation: Lawyer,0
GOP Rep Asks Protesters What Gun They'd Want To Be Shot With,0
Disney CEO calls DeSantis anti-business and anti-Florida,0
Florida Democrats are trying to use Ron DeSantis' book laws against his own recently published book,0
Kid Rock's Violent Reaction to Bud Light's Trans Partnership Goes Viral,0
"Florida Democratic Party Chair Nikki Fried, senator among 11 arrested at abortion protest",0
Former US President Donald Trump to be arraigned on criminal charges in historic case,0
"Rep. Gloria Johnson to reintroduce ""red flag"" gun bill in light of Nashville school mass shooting",0
"Most anti-trans adults don’t actually know a trans person in real life, new study reveals",0
Dems dump 500 pages of DeSantis opposition research,0
Rep. Schiff to Psaki: McCarthy acting as 'surrogate criminal defense team' for Trump,0
Donald Trump's lawyers have vowed to fight his indictment. Here's what happens next,0
Tennessee Republicans Are Trying to Expel 3 House Democrats for Siding with Kids on Gun Control,0
"Trump to be charged Tuesday with 34 felony counts, but spared handcuffs and mug shot",0
"3 Democrats in the TN House face possible expulsion, the first time in state history it would not be bipartisan",0
"Sean Hannity’s attempt to coach Trump backfires — again
“The most striking exchange came on the question of possession.
“I can’t imagine you ever saying: ‘Bring me some of the boxes that we brought back from the White House. I’d like to look at them,’” Hannity said. “Did you ever do that?”
Trump didn’t directly answer the question, saying merely: “I would have the right to do that. There’s nothing wrong with it.”
So Hannity tried again: “But I know you. I don’t think you would do it.”
It turns out Trump would.
“Well, I don’t have a lot of time. But I would have the right to do that,” Trump said, before adding that, in fact, “I would do that. There would be nothing wrong.”
His ally quickly tried to pivot to another topic — “All right, let me move on,” Hannity said — but Trump plowed forward.
“Remember this: This is the Presidential Records Act. I have the right to take stuff,” Trump said, adding: “I have the right to take stuff. I have the right to look at stuff. But they have the right to talk, and we have the right to talk.”",0
Senate Democrats ask military to protect abortion access for service members: 36 Democrats and two independents expressed support for the Pentagon's policy of providing paid leave and travel expenses for service members getting abortions,0
No Labels group raises alarms with third-party presidential preparations,0
Analysis | Democrats weigh trying to force Supreme Court to adopt ethics rules,0
"So MTG is in NYC spouting her lies about democrat ran cities. Meanwhile, in Georgia….
Facts are so painful for Republicans.",0
It’s tough to imagine a Toadstool mushroom causing so much havoc 🍄🍄🍄,0
"Bob Iger calls DeSantis policies 'anti-business' as tensions between Disney and Florida grow
Don't mess with the Mouse.",0
Anyone giving money to this fraud is an idiot. This is a multi million dollar plane. It is his personal plane. Stop giving him money! He can pay for his legal woes himself! SELL YOUR DAMN PLANE IF YOU’RE OUT OF MONEY!!! Stop begging for money from your less than intelligent base!!!!,0
Disney Chief Bob Iger calls Gov. DeSantis' actions 'anti-business and anti-Florida',0
Democrats target 31 GOP-held seats in aggressive campaign for House majority,0
Biden and his 2024 campaign: Waiting for some big decisions,0
Why remote work is becoming a blue-state privilege,0
Biden in no hurry to announce 2024 re-election campaign,0
DeSantis wants ‘media accountability.’ A new bill makes suing journalists easier.,0
A broader take on the 60 Minutes interview.,0
Oh no! Anyway.,0
Neo-Nazi Arrested for Firebombing Church Hosting Drag Queen Story Hour,0
"Majority-Black town fights to stop land being seized for gravel quarry rail link, A majority-Black rural community in Georgia is battling to stop a railroad company from seizing private land for a new train line they say will cause environmental and economic harms.",0
Free Speech Is Not Just for Conservatives,0
GOP divided over how to handle Trump indictment,0
Justice Dept. said to have more evidence of possible Trump obstruction at Mar-a-Lago,0
Warren Calls on Top Five Egg Producers to Explain Recent Egg Price Hikes | U.S. Senator Elizabeth Warren of Massachusetts,0
"When you focus on policies and not petty fighting, things get done.",0
Twitter removes verified check mark from The New York Times following dispute over subscription fee,0
Sanna Marin loses in Finland..,0
Texas Republicans tried removing a book criticising the KKK from public libraries. They aren't even hiding it now...,0
"Republicans, the Party of “Defunding the Police”
Georgia Republican Rep. Andrew Clyde, a gun shop owner and a member of the House Appropriations subcommittee that oversees ATF funding, has already signaled he doesn’t foresee a funding increase “in any way” for the agency. Rep. Andy Biggs (R-Ariz.) took it a step further, saying his hope was that Congress will “reduce funding” or “eliminate” the agency, which he called “woke.”",0
Democratic leader wants California to repeal ban on government travel to anti-LGBTQ states,0
no lies detected,0
A Poem About School Shootings By A High School Student,0
Fox News panel justifies death threats to Stormy Daniels: 'Take the money and keep your mouth shut',0
"Opening for Democrats? 1 in 8 prospective freshman won’t attend college in Florida, cite DeSantis education policies",0
They are all extremists,0
"Koch Brothers dominated the GOP and that was ok... But let one liberal donate and bam! Jewish conspiracy!
Breaking down Trump’s ‘Soros’ attack on the Manhattan DA",0
"‘Delay, delay, delay’: How Trump could push his trial into the heart of campaign season",0
Spotted at the West Palm Beach Airport.,0
Tells you everything you need to know about the Republican Party.,0
Just Biden my time.,0
"Ron DeSantis blasts George Soros prosecutors again, but won’t say Donald Trump’s name",0
Why Trump could end up in jail if he can't keep his cool about being indicted,0
"Anti-Obamacare judge takes latest swipe at ACA, rules that employers don't have to provide access to screenings, anti-HIV medication",0
Dennis Quaid has officially lost his mind.,0
A Republican Appointed Texas federal judge takes another shot at Obamacare,0
Seen on a Disney land guest haha!,0
Just sayin’,0
"Every bit helps. This is the final stretch, folks. Plz do what you can.🇺🇸",0
Ben Shapiro says trans people should be banned from owning firearms,0
"At Mar-a-Lago, 30 People Show Up to Protest Trump’s Indictment.",0
Sen. John Fetterman discharged from Walter Reed after receiving treatment for depression,0
"Please ready the restrict act. This is very dangerous for freedom of speech on the internet
This is a post I made earlier regarding the restrict act that is being presented to the senate. Email, call, and write letters to your representative to ensure that this bill doesn’t pass. Read through it discuss",0
How a fake Nashville manifesto fueled anti-trans rage online,0
"Jury finds ex-GOP operative Lazzaro guilty in federal sex trafficking case. federal jury on Friday found Anton “Tony” Lazzaro, a one-time Minnesota Republican political operative and top donor, guilty on all counts of sex trafficking five girls, ages 15 and 16.",0
Why Hundreds of Wisconsin Doctors Are Asking You to Vote in Next Week’s Supreme Court Race. More than 300 Wisconsin physicians and healthcare professionals announced their joint endorsement of Milwaukee County Judge Janet Protasiewicz in next week’s state Supreme Court election,0
Texas Republicans Introduce Bill Allowing Secretary of State to Overturn Election Results,0
California's Newsom starts tour to boost red-state Democrats,0
They don't actually care about protecting kids,0
AP News: Judge: Dominion defamation case against Fox will go to trial,0
"Biden Administration Appeals Texas Judge’s Ruling Against Obamacare, PrEP Access",0
VPN Users Could Face Decades in Jail Und,0
"Tiny D is losing his mind.
Love seeing him ruin his political career on a daily basis.",0
