text,label
"Shower thoughts this morning...
If banning abortion and restricting when medical professionals are allowed to intervene when a mother's life is at risk because it's ""God's will,"" then could we say the next time a Republican went into cardiac arrest, the paramedics shouldn't be allowed to perform CPR because that's ""God's will.""

This probably sounds darker than I intend for it to, but I'm just trying to put it into perspective that abortions are *healthcare*, no different than emergency surgery to save someone's life. If ""God's will"" is their argument, tell them to stop going to the doctor's office and ERs when they're sick, injured, or on death's bed if ""God's will"" be done. 🤷‍♀️",0
Donald Trump's emperor-has-no-clothes moment,0
"How can Democrats market themselves as the accepting, inclusive party but at the same time be so quick to label anyone who is Republican as a Fascist bigot who wants to overthrow democracy?
There are plenty of respectable people who are open to hearing each other out, but at the same time there are some many people from the left that, in my personal experience, are ready to bash anyone who has the slightest difference in opinion.",0
Denying The 2020 Election Wasn’t A Winning Strategy For Political Newcomers,0
Inside the Justice Department’s decision on whether to charge Trump in Mar-a-Lago case,0
"Do you think welfare should ever taper off? Maybe give people (who could work) 2x or even 4x the current benefits this year, current benefits next year(1x), and then half (.5), then half again (.25), etc.
My thought is that people typically need a lot of help at first (and the only way to do that without increasing the total money available, it to give less later). I know they may re-start the cycle a few times… I had a conversation with an empathetic conservative about learned helplessness, and one generation of welfare recipients teaching their kids what they know—welfare. And just how that mentality can hurt the kids’ mental framework and aspirations. 

Thoughts?",0
"Can we PLEASE talk about the train-wreck that is the Florida Democratic Party? (x-posted r/VoteDEM)
I've seen a lot of commentary from people saying that Florida is just unwinnable because of some demographic inevitability even though Andrew Gillum missed being elected governor by less than 0.5% just four years ago.

FLDems neglected organizing and retail campaigning two years ago and got curb stomped. Manny Diaz ran for state party chair promising to clean up the mess, but then promptly ignored the lessons learned and now in 2022 we have another disaster.

Thankfully, FL Sen. Shevrin Jones has articulated a call to prioritize year-round organizing and offering solutions to skyrocketing costs of living impacting constituents instead of scattershot messaging about the GOP culture war and consultant lead election season scrambling.

I encourage everyone to read his statement regarding the causes and solutions for the current state of the FLDems.

https://mailchi.mp/shevrinjones/election-results",0
"Musk Warns Twitter Bankruptcy Possible
[https://www.bloomberg.com/news/articles/2022-11-10/musk-tells-twitter-staff-social-network-s-bankruptcy-is-possible](https://www.bloomberg.com/news/articles/2022-11-10/musk-tells-twitter-staff-social-network-s-bankruptcy-is-possible)",0
"What are the worst qualities of conservative views?
What are the main problems or worst quality of modern conservative viewpoints in your opinion?

Edit: To anyone who thinks I made this post to argue, I didn't. I want this to be a constructive space for people to truly voice their opinions for me and others to hear. Me asking questions on your comments is just my way to gather more info and hear out your viewpoints.

Edit #2: Thank you to everyone who has chimed in, I am loving the responses and enjoy learning your viewpoints. This post is not for anything other than expanding my own (and hopefully others) horizons. I appreciate the constructive conversations and viewpoints I haven't heard before.",0
The biggest midterm takeaway: The economy is stronger than we thought,0
"Volunteers Needed in NV
Volunteers are needed to cure (fix) ballots in Nevada by 11/14/22: I'm hearing vote by mail in NV is going 65% Democrat.  Unfortunately I've also heard about 1000 ballots per day have been rejected from the mail in ballots.  Volunteers are needed to help voters cure their ballots.  If you have time to save Democracy:
https://m.dailykos.com/stories/2022/11/9/2134907/-Volunteers-needed-Call-Nevada-Democrats-to-cure-their-ballots",0
"I don’t see this cycle as a victory.
Not getting trounced as expected but still losing all over the place is not a victory.  A true victory would be dismantling the GOP industrial complex.  The QAnoners the right wing nuts the Trumpers and sadly the uneducated and brainwashed will still continue to vote.  This country is nowhere near out of the woods and a fascist takeover is still possible and still underway.",0
"President Joe Biden said that it remains his ""intention"" to run for reelection in 2024.
Is this really the best we can do??",0
"We are celebrating way too early about the Senate. There are still ways Republicans could gain control of it.
They're ahead in Nevada at the moment and the Georgia election was so close it went to a runoff.

If they win any two of the three remaining Senate races that haven't been called (E.g. let's say they win in Nevada and regroup to win the runoff in Georgia) then they control the Senate despite Kamala Harris' tiebreak power.

Combine that with the fact that they are more likely than not to control the house and this could still be very bad.

This could be the reverse situation of 2020. In 2020 Democratic voters were initially disappointed with the results ""Where was the blue wave?"" and then took the Senate in the Georgia runoffs. The exact same thing could still happen here in reverse.",0
"Delete if not allowed: ""Trump is 'screaming at everyone' after watching his hand-picked candidates flop: CNN's Jim Acosta""",0
"Do we still have a chance to keep a majority in the Senate at this point?
Nevada and Alaska are leaning red so far and most likely going to go that way. Even winning Arizona, we’d still be behind. Looks like it’s game set match or am I missing something no matter how Georgia ends up in the runoff.",0
"How come no one is talking about the utter defeat of the ProtoTrump - Sarah Palin
Her dem opponent who is in Congress for only a couple of months wiped the floor clean.

Compare that to the Texas GOP congresswoman who complained that Repub and Independent did not show up.",0
"“Red Wave” coming.
The Democrats did historically well. I’ve been glued to the coverage and this reinforces my confidence in the party, and overall that the US is not as “red” as the noise makes it seem. The “red wave” did not materialize as we thought, but… I’m still not convinced. We’re going to lose the House and the Senate is still uncertain. If (when) the Georgia race heads to a runoff, I have less hope as Democrats struggle with them. My prediction is that Republicans will hype this runoff as another “red wave.” Let’s say they win Senate. Their propaganda machine will squeeze out every ounce of victory parading out of this and all our progress will be for nothing. Please, convince me I’m wrong and make my day.",0
"Trump Reportedly 'Livid,' 'Screaming at Everyone' over Midterm Results",0
"We need to start referring to the Conservatives as Goliaths and us as David’s.
You’d think no one would root for Goliath but here we are.",0
"Biden ushering an historically great showing in the midterms. Now what?
When the day began I was giddy because I'm a political junkie but fully expecting to see a republican victory - certainly in the House and perhaps in the Senate. Part of this is surely my inherent pessimism which comes from being a liberal, part of this is based in historical trends in Democrats underperforming polls in the last few election cycles and in the past few decades of the party with the presidency getting shellacked in the midterms (2014 Ds -14, 2010 D's - 63, 2006 R's - 30), and mostly because the fundamentals - namely inflation - created such a strong headwind for the Democratic party.

As it stands shortly after midnight EST, we are seeing an amazing result! Democrats are dramatically outperforming even the most optimistic democratic scenarios and the mood on Fox News is hilariously somber.

What are the takeaways from this great night so far and how will you be engaging with your family, friends, colleagues and fellow citizen tomorrow and in the coming days and weeks? We will need to combat election fraud doubts which we are already seeing from the MAGA crowd and we need to be able to frame how amazing of a night this was for Democrats so we can capitalize on this momentum headed towards '24.",0
"Money doesn’t buy happiness… it buys elections.
What you notice when you lose the powerball and major electoral races in the same day.",0
Mike Lindell Accuses Attackers of Sabotaging Election Night Activities,0
"I want to change the world.
Not sure if this is the right sub, will delete if not.

I am a white transgender teen living in Quebec, and I want to change the world around me, no matter how big or small. I want to promote indigenous rights and help feed people in need, and give any resources I can. Im not sure how to help, but I was wondering if any fellow Liberals out there could help give advice or ideas?   
If anyone knows any respurces in Montreal, or common issues I could help aid? Thank you all!",0
"An Argument Against Deontological Libertarianism
Deontology is based upon rights to things that come from self-ownership. Self-ownership can be shown to not be objective and universal. Labor that transforms the Earth does not generate a property right. It is possible to know that enforcing property will encourage investment and that a person will become less happy if something is taken from them. However, a right can not be known from that fact.

There can be a utilitarian justification for rules that increase investment. Labor is any transformation of the world used to change the future. All labor is not the same, and nothing moral can be deduced from labor. An example would be the labor of a soldier. This labor seems amoral to Libertarians.  The motivation for all conversations about rights is always some economic good.

Whenever someone says that their rights or freedom were violated it means their happiness was reduced. All examples of happiness being reduced can be understood with economics, psychology, and neuroscience. Those fields are completely amoral and descriptive without the concept of freedom. A useful concept here is the utility function.

Most Libertarian texts do not argue for natural rights in themselves but connect rights with something humans usually are concerned with. Two good examples would be Man, Economy, and State by Rothbard and Anthem by Ayn Rand. The book by Rothbard argues that Libertarian policies would raise living standards which shows there is a confusion and that what is actually important to the reader and author is economic growth/living standards. The book Anthem connected the idea of freedom with a story of a socially isolated person that invents the lightbulb. The book is actually about social isolation, and about technological progress. Living standards, social isolation, and technological progress are all things that effect an economic agent's utility function. The utility function is actually what is important to economic agents rather than rights.

It is true that certain events such as death or violence have a large negative effect on any persons happiness. Since a lot of utility is lost many conclude that a right was violated. It would be false to conclude that because any example of something that seems to be a rights violation can be generalized as a particularly low part of a utility function. Under utilitarianism, death would certainly be a thing that must be minimized as much as possible because of its large negative effect on the overall happiness of everyone.

For people to own their bodies their mind must be separated from their body. This is not the case, and people actually are their bodies. If the universe thought we ought to always possess our bodies human beings would never die. What can be proved by our experience of our bodies is that Homo Sapiens evolved on the planet Earth. Nothing moral can be proved from that fact. There is no special and necessary relationship between me and my body. A persons body is a collection of cells rather than a single moral object. If controlling someone's finger while they were asleep were necessary to push a button that prevented the end of the world than it might be very wrong to never violate self-ownership.",0
"My wife is a poll worker has this report
We live in a ruby-red rural county and our polling location has now clocked a record number of voters before 10:00.  Today is going to be a wave, what kind of wave is going to possibly kill me waiting to see .",0
Trump’s company appeals judge’s decision to appoint monitor,0
Elon. Trump. Resentment,0
Why Americans living abroad are a voting bloc with untapped political potential,0
Trump Lawyer Issues Stern Warning to DeSantis Over 2024,0
Twitter owner Musk backs Republicans on eve of U.S. midterms,0
Dual citizens abroad say it's worth ballot obstacles to make sure their votes count,0
"Can someone help me understand this proposition on the Louisiana state ballot?
""Shall the City of New Orleans renew the levy of the Lake Oaks Subdivision Improvement District’s (“District”) annual parcel fee, not to exceed four hundred dollars ($400) per year on each parcel of taxable real property located within the District, which is that area of the City of New Orleans specified in Resolution R-22-93 of the New Orleans City Council, for a period of four (4) years, commencing January 1, 2023 and ending December 31, 2026, which fee is estimated to generate approximately $110,000 annually, to be used for the primary object and purpose of promoting and encouraging the beautification, security, and overall betterment of the Lake Oaks Subdivision Improvement District, except a 1% City collection fee, and if used for additional law enforcement or security personnel and their services, such personnel and services shall be supplemental to and not in lieu of personnel and services provided in the District by the New Orleans Police Department?""

&#x200B;

It's there in three places for three neighbors. The details (amount, timeline) vary slightly but the gist is the same. What would happen if they pass? Who benefits and who is harmed? Thanks for any help!",0
Russia's Prigozhin admits interfering in U.S. elections,0
"my vote today
BLUE, BLUE, BLUE!!",0
California Poised to Overtake Germany as World’s No. 4 Economy,0
"Does phone-banking technology need to be so awful?
I've phone banked many times over the years and every single election cycle the technology continues to remain horrible. Buggy software that makes you wait 15 minutes between calls, laggy display of the voter's name which makes it impossible to initiate a call, etc.  The last time I phone banked for two hours and talked to one person.

I can't help but imagine a system or app that's easy to use and whose interface isn't a jumbled mess. It would significantly lower the barrier to entry for so many people for whom making calls is already scary enough. Is this a pipe dream?",0
"Ron DeSantis: The Groomer
I'm just finding out about this. Is it well known DeSantis was a high school teacher who partied with underage students?

Just another conservative doing the hypocrisy thing (an actual groomer on a crusade against the LGBTQ2S+ community).",0
"What happens when white privilege runs out?
What happens?",0
"Do we need laws protecting the peacefully transfer of power?
Regardless of the results of this election we already know that some Republicans will not concede. Maybe it's time for some rules. Eventually we will have a GOP incumbent that will not transfer power after losing. It's coming.",0
"Don't Give Them What They Want
I know we don't trust polls anymore but all this ""the Dems are doing great"" talk isn't helpful either. I looked at the polls for the first time and most say we don't have a chance. History says the same thing.   Are we setting ourselves up for giant heartbreak?

I can also already see the MSM headlines on Wednesday morning: Voter's failed/ Voter's have given their stamp of approval on Jan 6./ Voter's want women stuck in the 1950's/ White women hate people of color and are the devil/ Liberals don't care about the environment or democracy...

Even though they all know what the map looks like. The truth is there are many more GOP safe seats up for election this cycle than Dem. There are a ton of GOP uncontested races scattered throughout the country. History says the GOP takes power this cycle. A year ago all we heard was how likely it was for the GOP to take power due to the map.

Can it change? Sure.  Does that guarantee the GOP win? No.  But we all believed Trump couldn't win  -even though history said he would. Simply because he had an R next to his name.  I don't believe young voters have been given enough attention. And I believe they're going to be missing this cycle.

A lot of us are EXHAUSTED. We have worked hard. Participated. Donated. Voted. Volunteered. Won by historical numbers.   And yet we lost Roe. We have violence at the Capitol and dead children in our schools. We can't afford anything. We are using more oil than ever.  Voting rights are being taken away.  WW3 is knocking at our doorstep.

All of this should encourage us to work HARDER. But that's not always how humans work. We're exhausted. And we feel like the system is stacked against us. No matter what we do. And that even if we win, we still lose. We've all become disenfranchised to some extent. (Which is THE GOAL BTW)

I'm on a tangent now.  But the main point is don't let the MSM divide us further.   If we lose the midterms it's because the deck was stacked against us to begin with. And the GOP/Internet/Fox has propagandized their voters for years now. We literally live in two different realities. We get completely different news everyday. They're going to vote for the candidate with an R next to their name. Even when it's against their own interest.

Don't blame your teammates if we lose the midterms. ( I'm not speaking of the party itself, just the voters ). Don't let the MSM get away with blaming them either. Those who think like you, or similar enough to you, are not the problem.  It's going to suck enough. If we keep dividing ourselves, we will continue to lose our freedoms, progress and hope.

Hopefully, we win and my message isn't needed. Just throwing it out there because I'm already seeing signs of blame on MSM.",0
Trump Takes a Jab at Ron DeSantis During Oz Rally,0
"Obama Calls Out Dr. Oz for Selling Political ‘Snake Oil’ to Get Elected- “If someone’s willing to peddle snake oil to make a buck, then he’s probably willing to sell snake oil to get elected,” Obama said Saturday in Pittsburgh.",0
Donald Trump's Latest Lawsuit Looks Destined to Fail Bigly,0
"many people said Trump had the benefits of ""Obama's economy,"" but right now Biden is claiming responsibility for the current economy
Genuine question. Can someone tell me why this is?",0
California retirees lament the 'venom' coursing through politics,0
"Civil rights groups slam Musk’s mass Twitter layoffs, urge companies to pause ads",0
Kanye West Censored by ‘Free Speech’ Platform He Praised,0
"Do you think Trump will pay the $8 a month verification fee on Twitter or try to get out of it?
I think he’ll try to get out of it.",0
"Which investigations will the republicans end if they win house and/or senate?
This is something I worry about which might allow them to weasel away, but I'm not really clear how the law works on this. I keep being surprised how much they can over reach (who knew the president could fire the head of his investigation?)

Which investigations will the republicans be able to kill if they win the house or senate? Which ones are beyond their reach?

I have searched articles. But since this is a thing they often do in underhanded ways that aren't really obvious, and are questionably really legal, I can't find it laid out anywhere.",0
"Get ready for the Red Mirage on election night in Pennsylvania.
Every election the mail-in votes are counted last in populated areas like Philadelphia. The Republican candidates will be ahead by a few points by 10:00. By midnight or 1:00 A.m. the Democrats will have even things up. Republicans have been trained to not accept this fact. Some of them will declare victory before all the mailing votes are counted. Look for this in Arizona also and Nevada.",0
Worries Grow That TikTok Is New Home for Manipulated Video and Photos,0
American indifference will be the death blow for democracy,0
"We're asking you today to share this article with as many people as possible, but we're also asking for your help with what may come next.
 No Labels is making real progress in our goal to provide a home for the politically homeless. - And now, more people are starting to pay attention. [**Check out this just-posted Fox News article**](https://default.salsalabs.org/Tf4a55ed8-53d4-4e96-8a19-11923197a3a3/2fdb3b63-9449-4cd5-8d9a-9274a9092161) highlighting our efforts to lay the groundwork for a potential Unity Ticket in the 2024 presidential election.

From the article: ""' No Labels' officials and insiders say both the Republican Party and Democratic Party are becoming increasingly more extreme… Already, No Labels has begun work gathering 1.5 million signatures in all 50 states and Washington D.C. to gain ballot access.""

We're asking you today to share this [**article**](https://default.salsalabs.org/T7dfcd61e-b2b5-43be-8a8c-7c1287eb8b73/2fdb3b63-9449-4cd5-8d9a-9274a9092161) with as many people as possible, but we're also asking for your help with what may come next.

[NO LABELS](https://www.reddit.com/r/No_Labels/)",0
News From the Batshit: “Biden’s Address Incites Hate”,0
Why Democrats Are Losing Hispanic Voters,0
Saudi Aramco Reports $42 Billion in Profit as Cash Rolls In for Oil Giants,0
"How do election deniers account for when their candidates win? (serious)
Like I realize it doesn't make logical sense... but I'm curious if an articulation has been attempted anywhere?",0
Abortion-rights protesters briefly interrupt Supreme Court,0
"NY man sprung on no bail in Facebook-posted beating executes wife in front of kids just hours later
https://nypost.com/2022/11/01/ny-man-sprung-on-no-bail-in-facebook-posted-beating-guns-down-wife-cops/",0
"How many conservatives who accused Obama of being Muslim do you think will vote for Oz?
Lol. Hypocrisy at its finest.",0
"To Protect Her Twin Baby, Texas Woman Was Forced to Seek Abortion Care Out of State - Public Health Watch",0
"Yes, Elections Have Consequences",0
"what do you guys make of the recent negativity towards our chances in the midterms.
3 weeks ago, every network, even Fox News was saying that Democrats are ready to pounce even though it's a midterm that they should lose. Michael Moore said we were going to kick the Republicans in the teeth because of the Dobbs decision and January 6th. What changed? The pollsters can't be trusted to not change the narrative to make more money. Literally nothing has changed. The early vote numbers look good for a midterm year. I was wondering if this wasn't an attempt by the liberal media to scare people into voting.",0
Election deniers raised $13M from Fortune 500 companies since Jan. 6,0
"One week until Election Day
One week until Election Day. This is the  final stretch. Candidates are making their closing arguments to voters with just seven days to go until the high-stakes midterm elections. Control of both chambers of Congress and dozens of governorships are on the line. I don't care if you are a Democrat or a Republican. Join me at r/No_Labels and vote. ",0
Roberts grants Trump temporary hold in dispute over tax returns,0
Elon Musk’s Disastrous Weekend on Twitter,0
Why Polls Were Mostly Wrong,0
GOP bracing for Trump indictment soon after Election Day,0
Thousands Leave Twitter as Elon Musk Takes Over,0
We should have been using this argument already,0
Only the GOP Celebrates Political Violence,0
Lula da Silva will return to Brazil's presidency in stunning comeback,0
"Vote Like Your County Depends On It!
How on earth are polls swinging towards Republicans? Didn't they storm the Capitol and try to overturn the last election? I thought that would be a dealbreaker for at least a generation. Now it's no big deal? 

Get out there and vote, Democrats. Seriously, people. WTF?",0
"Midterms polling is looking worse, what happened?
I've been keeping track of the polling mostly using https://projects.fivethirtyeight.com/2022-election-forecast/

A few months out it was looking like the Democrats were favored to keep the Senate by a good margin with The Republicans favored to win the house. 

Now it's gotten much worse with the Senate in a dead heat and the House almost becoming a landslide. What's the deal? Why the sudden change?

It felt like Republican Senate Candidates like Herschel Walker and Dr. Oz we're getting caught saying something devastating almost every week. 

What do you all think is the cause? Personally I think it's the lack of Gen Z turnout for voting.",0
