text,label
"Democrat Indictment BACKFIRES, Trump Raises OVER $4M DOLLARS In One Day",2
Trump Supporter CONVICTED For Posting Meme In 2016 In SHOCKING Weaponization Of Government,2
"Manhattan District Attorney Alvin Bragg’s office has used about $5,000 in federal funds from the Justice Department's Asset Forfeiture Fund to investigate former President Donald Trump and the Trump Organization. https://www.conservativenewsdaily.net/",2
Indictment offers temporary ‘unifier’ between Trump and DeSantis as 2024 looms,2
"George Soros, a leftist billionaire, denied knowing Manhattan District Attorney Alvin Bragg, who indicted former President Donald Trump on Thursday. Soros stated that he has never met Bragg nor supported him directly. https://www.conservativenewsdaily.net/",2
Watch: Dad Goes off on School Board About Assignment Asking HS Students to Describe 'Sexual Fantasies',2
"50 Years of Federal Investigations of Trump, Yet 'The Donald' Still Stands",2
Dark Humor: GOP Congressman Hands Out ‘Indict This’ Ham Sandwiches To Mark Trump Indictment,2
Trump campaign raises more than $4 million in 24 hours,2
Trump Lawyer Tacopina to Newsmax: Arraignment 'The Likes We've Never Seen',2
Trump Lawyer Halligan to Newsmax: Bragg's Actions 'Prosecutorial Misconduct',2
Donald Trump Jr CALLS IN To Timcast IRL SLAMMING Political Persecution Of Trump,2
Trump on the accusation: This is political persecution and election interference - Discover Politics,2
"Bragg Confirms Federal Funds Used in Trump Probe, Bolstering GOP Investigation",2
Trump Asks 'Where's Hunter?' Following Indictment,2
"Rep. Issa to Newsmax: Trump Again Being Prematurely Tried, Convicted",2
McConnell Mum on Trump Indictment,2
Trump Raises Over $4M After Indictment,2
Pro-Trump Memester Found Guilty Of Election Interference,2
Trump Attorney General Bill Barr: Indictment Designed To Sabotage GOP White House Chances In 2024,2
"How Trump could be elected president, govern from prison",2
"Journalist Debanked, Woman Arrested For Calling Macron Garbage, Joe Biden Joke & More #CBDC",2
GOP calls for Biden charges after Trump indictment,2
Winsome Earle-Sears fires back at Youngkin commencement protesters: 'They don't speak for us',2
Republican Presidential Candidate Vivek Ramaswamy Warns That America May Be Heading for ‘National Divorce’,2
Kevin McCarthy Directs U.S. House to Investigate Manhattan DA Who Indicted Trump,2
China & Brazil Ditch U.S. Dollar As Reserve Currency,2
Even the Washington Post Admits the Case Against Trump Is Probably BS,2
Jim Jordan: Is Alvin Bragg Investigating Hunter’s Anonymous Art Sales in NYC?,2
Nolte: Democrat Party’s Prosecutorial Abuse Crusade to Rig 2024 Election Has Only Begun,2
"Michigan Democrat Dan Kildee announces 'serious, but curable' cancer diagnosis",2
"Jesse Watters flips out on ""The Five"" as he discusses the Disgusting Indictment of Trump",2
Pelosi: 'We Have To Convict Trump On The Charges To Find Out What Is In Them',2
Wisconsin Republican introduces OMAR Act to prohibit campaign compensation for candidate spouses,2
Gov. DeSantis Reveals If Florida Will Extradite Trump to New York,2
I Couldn’t Believe What I Saw At Biden’s Lawless Open Border,2
Trump will be first president arrested since Ulysses S. Grant,2
"Manhattan District Attorney Alvin Bragg's office has issued a scathing reaction to House Republicans who demanded information on the case against former President Donald Trump, stating that they must cease ""unlawful political interference"" in the matter. https://www.conservativenewsdaily.net/",2
Ron DeSantis teases next moves in Disney battle: ‘You ain’t seen nothing yet’,2
Christopher Wray and the Politicization of the FBI,2
"WA close to legalizing the harboring of runaway minors and giving them free medical ""gender affirming care""",2
"I have no business here… Hi American friends,

I have no business here and you might find this women stupid. I did to start with… 

But I think she talks about some kinda scary shit, so I wanted to share.",2
Rep. Gary Palmer: Trump Indictment Is an ‘Attempted Political Assassination,2
Mike Pompeo: Trump Indictment Undermines Confidence in Justice System,2
"Lindsey Graham: This Ends With Trump Winning in Court, and ‘At the Ballot Box’",2
Kevin McCarthy on Trump Indictment: House Will Hold the ‘Unprecedented Abuse of Power to Account’,2
Trump’s solution to economic strife: ‘unleash American energy to get prices down immediately’,2
Trump continues to be the top voice promoting peace: ‘The war has to stop now’,2
Trump reacts to Manhattan grand jury indictment: ‘I believe this Witch-Hunt will backfire massively’,2
President Trump’s family stands with him amid grand jury indictment,2
Patriots stand with 45 as Manhattan grand jury votes to indict President Trump,2
The witch hunt continues: Manhattan Grand Jury reportedly votes to indict President Trump,2
Every 2024 GOP Hopeful Better Be Ready For Trump Treatment,2
Trump Indictment Launches Era Of Police-State Politics In America,2
Nevada Rejected Potential Result Changing Ballots In Senate Race,2
"Senior GOP, 2024 Hopefuls, Rally Behind Trump",2
McCarthy: Trump Indictment 'Irreparably Damaged' Country,2
Nancy Pelosi mocked over major error in her tweet about Trump indictment,2
Pelosi’s Statement On Trump Really Gives The Game Away,2
‘Political Persecution and Election Interference’: Donald Trump Slams New York Grand Jury’s ‘Witch Hunt’ Indictment,2
Blue State Blues: The Trump Indictment Is An Assault on Democracy,2
"‘Political Persecution, Election Interference At The Highest Level In History’: Trump Responds To Indictment, Will Reportedly Surrender Early Next Week",2
Trump Faces 30+ Criminal Charges In Manhattan Grand Jury Indictment: Report,2
"According to CNN sources, former President Donald Trump is facing over 30 criminal charges related to business fraud in a sealed indictment from the Manhattan Grand Jury. Trump was reportedly caught off guard by the indictment, and it is the first time in U.S. https://www.conservativenewsdaily.net/",2
Trans Day of Vengeance protest to continue in wake of Covenant School killing,2
America’s Banana Republic Era Is Here: Manhattan Grand Jury Votes To Indict Trump,2
BREAKING: Donald Trump Officially Indicted,2
Rep. Comer to Newsmax: Bidens 'Stonewalling' in China Probe,2
"Trump Statement: Political Persecution, Election Interference",2
"Trump Indicted in New York, a First for a US Ex-president",2
Trump Responds After Being Criminally Charged,2
White House says 'trans community' is 'under attack' after Nashville shooting,2
Trump Opens Up 30-Point Lead Over DeSantis In New Poll,2
"Trans Terrorists move ahead with plans for ""Day of Vengeance"" mere days after shooting",2
Statement By Donald J. Trump On Grand Jury Indictment,2
"Twitter removes over 5,000 tweets about radical group's 'Trans Day of Vengeance'",2
Competitive cyclist urges women to speak out after biological male wins NYC race against females,2
Trump indicted after Manhattan DA probe for hush money payments,2
Donald Trump arrest news: Former president charged in hush money case,2
Grand jury indicts Donald Trump,2
WATCH: Libs of TikTok Creator Confronts AOC After Filing Ethics Complaint Against Her,2
BREAKING: Anti-Second Amendment Activists Storm Tennessee State Capitol (VIDEOS),2
Merrick Garland Ordered Police NOT To Arrest Far Left Extremists At SCOTUS Homes,2
"Massie Offers Solution For School Shootings, Bowman Shouts At Him",2
There could be many violent reactions to transgenderism's collapse,2
House Committee Subpoenas State Dept. for Afghanistan Cable,2
QAnon Shaman Jacob Chansley is released early from prison,2
"Benedict Arnold, Bill Clinton, Joe Biden and Alejandro Mayorkas – liars and traitors all",2
Southern Wesleyan University president: ‘We’re not hiring people who endorse critical race theory’,2
"ID & MT legislatures ban transsexual ""care"" for minors, total is now 13",2
Popular MAGA President Donald Trump talks about his relationship with the Obamas and Bidens,2
Biden’s first veto could make your retirement account go woke. Here are 5 steps to protect your savings,2
"Activists on Wednesday demanded that the state of California pay millions of dollars to each Black resident as reparations for slavery and subsequent discrimination, dismissing payments of $5 million per person as ""nothing"" and ""too little."" Activists https://www.conservativenewsdaily.net/",2
"Biden’s job approval ratings take a tumble again, imperiling reelection plans",2
"Mark Warner Lets Loose on Biden on Classified Docs, 'Worse Than Trump,' Now He's Taking Action",2
How Much Longer Can Western Governments Spit on Their People?,2
Video: All Hell breaks Loose As Democratic Congressman Starts Screaming At Jim Jordan Demanding That Witness Testimony Be Stricken From The Record During Weaponization Hearing,2
QAnon Shaman Jacob Chansley is freed from prison 14 months early after his lawyer said Jan. 6 footage showing him being escorted into Senate by cops was exculpatory,2
War over the corporate kingdom: DeSantis' new board spars for control with Disney,2
WATCH: Republican Reveals Articles of Impeachment Live to Biden Secretary During He,2
Joy Behar: ‘Trump Is The One Who Needs To Get The Nomination Because Then Democrats Will Win’,2
Voter Suppression Is Real And It's Not What You Were Told,2
"Jamaal Bowman Throws Unhinged Fit Against GOP in Hallway, Thomas Massie Drops a Little Reality on Him",2
WH Refuses to Rule out Confiscation of Guns In Concerning Remarks,2
Sen. Budd to Newsmax: Biden Politicizes Guns Without Knowing Facts,2
"Biden’s ‘Summit for Democracy’ Attracts Apathy from Allies, Mockery from Dictatorships",2
James O’Keefe Exposes Potential Money Laundering Scheme By Democrat Fundraising Group ActBlue,2
Twitter Says Parts of Its Source Code Were Leaked Online,2
FBI Vows To Get To The Bottom Of What Christians Did To Provoke Attack,2
TUCKER CARLSON: The trans movement is targeting Christians,2
"RESTRICT Act, Labeled a ‘TikTok Ban,’ Includes Jail Sentences, Huge Fines for American Citizens",2
White House dodges question on whether 'assault weapons' ban will lead to 'confiscation',2
"Air Force hosts drag show at kid-friendly 'diversity, inclusion' festival on base",2
Stupid America - Johnsmustache.com,2
BREAKING: JPMorgan chief Jamie Dimon executive to be deposed in Epstein lawsuits,2
"Ted Cruz to Secretary of Homeland Security Mayorkas: ""You're willing to let children be raped!""",2
Comer: No way China would send millions to Biden's 'if they didn't expect a return',2
Press Secretary For Gov. Katie Hobbs Resigns After Tweet Suggesting ‘Transphobes’ Should Be Shot,2
‘F***ing Sick Of The Knee Jerk ‘It’s The Guns”: Megyn Kelly Rips Gun Control Advocates After Nashville Shooting,2
"Podcast host Joe Rogan said the establishment news media has lost control of the narrative, a result of them ignoring the biggest stories happening in the world, like the current citizen uprising in France. https://www.conservativenewsdaily.net/",2
"Sen. Rand Paul discussed his most recent findings regarding the causes of COVID-19 and the presence of previous National Institution of Allergy and Infectious Disease Dr. Anthony Fauci, who"" lied to us"" about it. https://www.conservativenewsdaily.net/",2
"The Scourge of Hegemon USA- If nations had personhood, hegemon USA would be diagnosed as psychopathic, sociopathic and pure evil.",2
Biden Trails Current GOP Runner-Up DeSantis in 2024 Race,2
Stop Calling My Miscarriage An Abortion,2
Nashville Mass Murder Shines Spotlight On Trans Violence And Its Enablers,2
BOMBSHELL: James O'Keefe Uncovers Massive Potential Political Money Laundering to Democrat Campaigns,2
Biden Doubles Down on Refusal to Negotiate the Debt Ceiling,2
BOMBSHELL: James O'Keefe Uncovers Massive Potential Political Money Laundering to Democrat Campaigns,2
A Guide to Understanding the Hoax of the Century,2
Congress Could Have and Can Stop School Shootings But They Haven’t,2
"Steven Shaviro, a professor at Wayne State University, has been put on administrative leave after making the now-deleted Facebook comment that it was"" more outstanding"" to kill conservative speakers than to join with them. https://www.conservativenewsdaily.net/",2
"Following the shooting deaths of three kids and three employees at a Christian school in Tennessee, Federalist CEO Sean Davis was removed from his Twitter accounts on Tuesday night for falsely reporting on the"" Trans Day Of Vengeance."" A https://www.conservativenewsdaily.net/",2
"According to recent reports, a federal judge has ordered former Vice President Mike Pence to testify before a grand jury as part of a criminal investigation into Donald Trump's attempts to remain in office after losing the 2020 presidential election. https://www.conservativenewsdaily.net/",2
"Drag queen straddles girl at North Carolina public school, video shows",2
Nashville Covenant School head of school hailed as hero in wake of shooting: 'She protected her children',2
Hunter's Art Dealer Doesn't Give Committee Requested Info,2
Lott to Newsmax: Gun-Free Zones Are 'Magnets' for Attacks,2
FBI Isn’t Treating Nashville Shooting As Domestic Terrorism,2
Katie Hobbs’ Spokeswoman Blasted For Horrific Tweet Following Nashville School Shooting,2
Don’t Let Biden’s All-Time Offensive Response To The Nashville Shooting Get Buried,2
House Reps Highlight Luzerne County's 2022 Voter Suppression,2
Ted Cruz and Josh Hawley Expose the Biden Team in Brilliant Grilling of Mayorkas,2
"Joe Biden Keeps Doing Inappropriate Things After Nashville Shooting, and Josh Hawley Has Had Enough",2
"Biden Has 'Hot Mic' Reveal Instructions, Gets Loose From Handlers, Makes Bizarre Gun Comments",2
"After joking about ice cream after the Nashville shooting, Biden doubles down, joking more about it answering a reporter the next day",2
Tucker: The Nashville school shooting happened due to deranged ideology,2
Trans activists are calling for more blood after the Nashville shooting. Here's how Christians should respond.,2
Eleven state legislatures have banned transsexual drugs/procedures for minors,2
Twitter Suspends Rep. Marjorie Taylor Greene’s Congressional Account Over Tweets About ‘Trans Day of Vengeance’,2
Joy Reid Criticizes Tennessee Legislation Seeking To Restrict Children Attending Drag Performances,2
White House’s push for woke foreign policy will backfire with our socially conservative allies,2
‘Hate Has Consequences’: Trans Resistance Network Says Death Of Nashville Shooter Was A ‘Tragedy’,2
Trans Activists Threaten To Kill Tennessee Lawmakers,2
"Journalists mock prayer, drag show ban after Christian school massacre~~~~",2
IRS Agent Visited The Home Of ‘Twitter Files’ Journalist On The Same Day He Testified About Government Weaponization,2
Obama Blames Trump For China’s Rise,2
"Woke Disney Begins Mass Layoffs with TV Production, Acquisition Employees",2
Nashville Christian School Shooter Was Second ‘Transgender’ Female Killer in 4 Years,2
"A former middle school basketball teammate of Audrey Hale, the shooter at Christian Covenant School in Nashville, received disturbing messages from Hale the morning of the mass shooting that killed three adults and three children. https://www.conservativenewsdaily.net/",2
"A former middle school basketball teammate of Audrey Hale, the shooter at Christian Covenant School in Nashville, received disturbing messages from Hale the morning of the mass shooting that killed three adults and three children. https://www.conservativenewsdaily.net/",2
"3 Dead, 8 Blind, 4 Eyeballs Removed — From These Three Brands Of Eyedrops! - Patriot",2
Trump Again Defines National Priorities › American Greatness,2
"Americans have replaced the values that once united us with multiculturalism, self-hate and money",2
Why Vote GOP?,2
Musk invites Twitter fact-checker community to check Biden's condemnation of 'MAGA' Republicans,2
"DeSantis just ""doubled the number of students with access to universal school choice in America""",2
Here is the definitive roundup of the media's despicable reporting after the Nashville shooting,2
Stocks rise after bank sale fuels investor risk appetite,2
"IRS Visits Taibbi, Rep. Jordan Demands Answers",2
Comer to Newsmax: Biden Family Was 'Actively Helping' CCP,2
Joe Biden Opens With Ice Cream Jokes Before Addressing Nashville Shooting,2
Taliban Making Hay With the Staggering Amount of Military Gear Left in Afghanistan,2
"Police Reveal 'Detailed Manifesto' to Nashville Attack, Yet Media Shamefully Try to Blame People on Right",2
Disturbing News: Attacker of Rand Paul Staffer Just Released from Prison - the Day Before,2
Here Are Leftists' Disgusting Takes On The Nashville Shooting,2
Joe Biden Opens Comments on Nashville Christian School Shooting with Jokes About Ice Cream,2
Barack Obama Falsely Claims Guns Are Number One Killer of Children,2
"Poll: Support for Traditional American Values, Patriotism Declines",2
"Staffer for Senator Rand Paul Brutally Stabbed in Washington, DC",2
‘Enough Is Enough’: Karine Jean-Pierre Blames Republicans For Nashville Shooting,2
"Meter Reader Leaves Terrifying Note Outside Man's Home, Explains Why He Couldn't Do His Job - Patriot",2
Fire leaves 37 dead and dozens more injured at Mexican migration center mere feet from US border,2
Introducing Bing new AI model,2
Judge shouted down at Stanford says 'mob came to target me because they hate my work',2
Pennsylvania Sen. John Fetterman has missed an alarmingly high percentage of roll-call votes due to illness,2
"Kentucky Sen. Rand Paul says staff member 'brutally attacked,' sustained 'life-threatening' injuries",2
Nashville school shooting: Biden criticized for joking about ice cream in first statement since attack,2
Biden makes ice cream joke in first statement since Nashville shooting,2
Nashville Christian School Shooter Identified As Transgender: Authorities,2
"BREAKING: Police Confirm Nashville Shooter Identified As Transgender, Wrote Manifesto",2
Nashville school shooter Audrey Hale identified as transgender and had detailed manifesto to attack Christian academy,2
Man 'Refused' To Help Woman Stuck In Snow Because Of Her Car's Sticker,2
Nashville Christian School Shooter Identified As Transgender,2
"Jack McPherrin: No—ESG Doesn’t Offer Investors More Choices, Nor Is It Part of the Free Market – Stopping Socialism",2
Six in 10 Americans don't want Trump to be president again: 2024 poll,2
‘He is an arrogant cheat’: Riley Gaines condemns ESPN for honoring Lia Thomas,2
Americans Get Selective About Leisure Spending,2
Kinzinger: ‘Trump as Jesus Movement’ Is a Real Threat to This Country,2
Poll: Most Say Biden Has Likely Not Told ‘Complete Truth About His Family’s Foreign Business Deals’,2
North Korea Just Tested A Weapon That Can Create A “Radioactive Tsunami” That Could Kill Millions,2
"Former ESPN commentator & known Nutjob Keith Olbermann: ""Donald Trump must be Arrested for his Terrorist Threats""",2
Top Republican Pollster Showing A Dominant DeSantis Lead Over Trump In Early Voting State,2
Governor DeSantis Just Signed A MAJOR Bill Into Law To Give Parents Ultimate Freedom,2
Biden vows to tank GOP effort to boost energy production,2
‘What A Coincidence’: Massive Donations Come To Light After AOC Defends TikTok From Possible Ban | The Daily Wire,2
Fight breaks out at Texas Capitol over trans activist's viral speech comparing lawmakers to Hitler,2
Trump: 'Stop Weaponization'; Dems 'Running Elections With Prosecutors',2
Pollster McLaughlin to Newsmax: Trump's Numbers Up With NY Case,2
Was Massive Vote Fraud Confirmed with a Fishtail?,2
First-Citizens Bank to buy Silicon Valley Bank,2
Michigan Lawmakers Roll Over for China and the CCP,2
The Conservative Case for Taxing Nonprofits,2
Federal Prosecutor Admits DC Police Officers Acted as Agent Provocateurs During Jan. 6 Riot,2
J6 Trial Reveals FBI Had ‘Complex Web’ of at Least 20 Extremist Group Informants in Run-Up to Capitol Riot,2
Taliban Releases Photos Of The U.S. Equipment They Seized From Biden’s Disastrous Pullout,2
Revelation of FBI Informants Shakes Proud Boys’ January 6 Trial,2
3 Alabama Thugs ‘Wake Up The Dragon’ After Shooting Marine,2
DAVID MARCUS: Ron DeSantis is conservative media’s darling—but it’s not backed up by the polls,2
John Kerry Defends World Leaders Who Fly Private While Pushing Climate Action | The Daily Wire,2
Trump rally goes silent after he attempts to mock DeSantis,2
Photos Capture Moment Dog Approaches Casket Of Deceased Owner,2
Trump: I'm being investigated for something that's not a crime - Discover Politics,2
When Satire Becomes Reality: Nearly 100 Babylon Bee Pieces Have Become Fulfilled Prophecies,2
Correcting the Record on Social Transition. Public schools treat “gender affirmation” of distressed kids as a neutral act. It isn’t,2
The Group the Chinese Communists Fear the Most,2
"Republican Leaders Introduce Historic Bill – If It Passes, It Could Erase Dr. Fauci’s Legacy Forever - Patriot",2
Andrew Cuomo slams Trump investigations as 'cancer in our body politic',2
"WATCH: Sen. Kennedy Wrecks Janet Yellen, WH During Grilling on US Economy",2
"Black Man Holds White Baby, Close Look Tells State Of ‘Race Relations’ - Patriot",2
Minnesota advances 'trans refuge' bill opponents say would strip custody from non-consenting parents,2
"Democrats: Men are women, black is white, Jan. 6 was an insurrection",2
How the Left Weaponized the Fact-Checking Industry,2
Trump rallying supporters in Waco ahead of possible charges,2
Electric Vehicles Bleeding Red Ink: Ford Is Losing Billions on EVs,2
Dems say parents don't have the right to raise their own kids,2
Grandfather Of Teen Killed During Burglary Says AR-15 Made Fight ‘Unfair’ - Patriot,2
Isolationism: Unrealistic and Ahistorical,2
Biden Administration Unveils New Restrictions On Air Conditioners Despite Backlash Over Gas Stove Restrictions,2
"When It Comes To The Left's Radical Agenda, No One Is Safe",2
NM Educator: Parents Have No Rights In Public Education,2
BLM Executed A Historic Shakedown Of American Corporations,2
Why Do Democrats Detest Parental Rights?,2
Rep. Cori Bush Wants to Take a ‘Public Health’ Approach to Gun Violence. Here’s What That Means,2
Exclusive – Indictment Backfire: Poll Shows Majority of Americans Think Charges Will Either Help Trump or Have No Effect,2
Poll: Most Americans Say Trump Charges Would Help or Not Affect Him,2
Rep. Tiffany to Newsmax: 'Trump Derangement Syndrome' Fuels N.Y. Probe,2
Trump on Russia-China-Iran Axis of Evil: Biden 'Forced Them Together',2
Trump on Biden: 'Not One Thing That He's Done That Turned Out Well',2
Trump: 'Stop Weaponization'; Dems 'Running Elections With Prosecutors',2
House Republicans Pass ‘Parents Bill of Rights’ Legislation,2
House Republicans Blast ATF In Hearing Over Pistol Brace Ban,2
"Woman Laid Dead In Walmart Bathroom For 3 Days, Cops Check Her Car",2
"If You See A Key Fob Wrapped In Foil, Here’s What You Should Know - Patriot",2
Pentagon doctors say children as young as SEVEN should be able to get puberty blockers,2
Energy Secretary Granholm insists gas stove standards will only impact high-end models: 'There's no ban',2
MG Show: Tara Reade talks about the allegations of Joe Biden's Sexual Assault against her,2
PART FOUR: Brunson Brothers Update!,2
"Democrat judge defeated, then County Commissioners create new unelected judge position and appointed him back into power in time to free vicious thug that paralyzed woman.",2
Pilot Welcomes Passengers Aboard And Reassures Them He Was Not A Diversity Hire,2
Black Lives Matter Activists Executed A Shocking $83 Billion Shakedown Of American Corporations,2
"Book ban attempts hit record high in 2022, library org says",2
"WATCH: Cori Bush Wants Us to Know She Won't 'Succumb to the Nihilist, Insurrectionist View of the 2nd Amendment,' America",2
"Biden annoyed at Kamala Harris for not 'rising to the occasion,' VP scared of 'messing up': report",2
Female competitive cyclers outraged as transgender women overtake sport: 'This is not OK',2
TikTok Hearing: US Lawmakers Question CEO During Testimony,2
"EXCLUSIVE —FBI whistleblowers are raising concerns over the bureau's involvement in a secret plea agreement conditioned by the U.S. government that stripped a defendant of their rights to own, buy, or even use firearms. https://www.conservativenewsdaily.net/",2
"A person has been given a three-year prison term after being charged with stealing then-House Speaker Nancy Pelosi's notebook computer and other criminal activity on January 6, 2021, at the U.S. Capitol. https://www.conservativenewsdaily.net/",2
"Virtue Signaling by Scientific Journals Backfires, New Study Finds. Nature's 2020 endorsement of Joe Biden changed no minds but did significantly undermine trust in science.",2
"Men Brutally Attack Cop — Patrol Car Door Opens, Fur Missile Launches",2
"Biden's Approval Comes Crashing Down Again, Barely Away from Lowest Point of Presidency",2
"WHO's public health emergency of international concern (PHEIC) FAKE, Trump & DeSantis, Joe Biden Joke, God Talk",2
BREAKING: Leaked Letter From Michael Cohen’s Lawyer DESTROYS Trump Indictment Witch Hunt - Patriot,2
Pentagon diversity chief receives no disciplinary action after probe into anti-White posts,2
Tara Reade's Allegations that Joe Biden violently Assaulted her will FINALLY be on Congressional Record. Investigation may be Coming Soon!,2
"Biggs: Hunter Biden deals all look ""suspicious to American people""",2
"Trump: Bragg 'Danger to Our Country, Should Be Removed'",2
